subreddit,created_utc,id,title,selftext,upvote_ratio,score,num_comments
Costco,1623484046,ny1g1y,Teenage girl harassed by a male employee,"I was too shaken up to talk to a manager while shopping. I could barely even talk to my dad when I went back to find him. But I was able to get the employees name, how do I go about reporting this to HR or like a manager to make sure this employee doesn’t do this to anyone else?",1.0,1,24
Costco,1623468009,nxxc5b,Does Costco sell hanging baskets of flowers? Rough price? (midwest USA),[removed],1.0,1,2
Costco,1623467264,nxx4b3,18 year anniversary,Would be my 18th year anniversary had i stayed .. So what am I missing out on?,1.0,1,1
Costco,1623463893,nxw4nm,PLEASE include the Costco location (City/State) where you found something.,"I asked once ""Where did you find this item?"" - Their response was ""Costco"". smh",1.0,1,2
Costco,1623462565,nxvqeg,Add burgers to food court!,,1.0,1,28
Costco,1623462254,nxvn4h,Anyone who works in Food Court feel that our department is just too overworked?,"Hey everyone, I've been working in the food court for a few years now and I feel like it's being too overworked. The costco I'm working at barely has any food court workers to the point where if some one goes on vacation, we have to work 6 days a week. Closing shifts on weekdays also don't have enough people in them and sometimes the warehouse forklift workers dont even drop the stuff we need for tomorrow.

Theres also so many orders now for this small kitchen, I feel like no matter how many people you put in the kitchen, the result will still the same because it's just too overpopulated. Not a lot of employees stay too and everyone just wants to leave. Idk maybe I'm just having a bad day but I feel like the food court isnt being updated to the current amount of people ordering from it.",1.0,1,57
Costco,1623458160,nxufg0,Returning my laptop,My laptop has a bad ssd and I want to return it to costco. Will they check to see if it boots when I return it or will they just take it no questions asked. Thank you!,1.0,1,18
Costco,1623451180,nxs8fk,Gun Safe,"The Big Horn Executive that goes for $300 has been out of stock. I called Costco cs and Rhino metels, neither was helpful. Anyone know when I might expect a restock?",1.0,1,3
Costco,1623443932,nxpmvz,Costco optical prescription,Is my prescription in all the Costco system or only in the local Costco?  Am I able to buy contact lenses in another state without doing another eye exam? Thanks!,1.0,1,2
Costco,1623425740,nxitqx,Nightmare of a delivery experience,"Ya'll I'm at my wits' end here.

I get a discount through work on appliances through LG. And they use costco logistics (innovel solutions) to deliver. I placed my first order for a refrigerator early april, item is scheduled for delivery beginning of May. They call and tell me it's raining so they can't deliver and will reschedule. I'm like whatever, fine. 

They delivered the item in a coupled of days, installed it and walked out before I got a chance to inspect it, it had a dent in the front, so i had to get them to to come pick it up for return the next day and I placed a 2nd order. It took a couple weeks for it to reach the warehouse and I finally got to schedule it for this monday. The 2 hour window  comes and goes, nothing from the delivery people yet, i called their support and the lady said she has no idea why but it was rescheduled to wednesday but it was on the truck for delivery and they didn't finish the route for some reason and thats why it got rescheduled, i'm like WTF nobody told me and I had to take the day off for this to stay home. She was like im sorry etc etc for your trouble and said it would be delivered on Wednesday. Tuesday evening i was supposed to get a call with my 2 hour delivery window - that didn't happen, I called support and they were closed. So I call first thing wednesday morning and the agent says he has NEVER seen this happen before but one system says it was scheduled and another didn't so it didn't actually get scheduled for delivery and he scheduled it for friday. So that's 2 days off wasted. And now it's friday, and i get a call from the warehouse saying they don't have the right item?! I'm LIVID. How was it on the vehicle for delivery on Monday if they never had the right item in the first place ? He said he has no idea how this was missed and will talk to the origin warehouse and see whats happening.

This is so fucking ridiculous. And costco support can't even help me with some kind of refund for all the trouble because my order is through LG. And LG doesn't have a support number for me to call through because it's a b2b partner website and my emails go unanswered for days -\_- I'm frustrated with both costco and LG. 1 month in the new house without a refrigerator.",1.0,1,25
Costco,1623425525,nxiqrg,When will this item restock? Can I ask via email for restock?,"Hello! I am in Canada Ontario and had my eye on my first computer that is also for school (I am required to have a computer with some minimum specs) and recently the item went out of stock! I really need one soon and wonder if there is some way I can ask costco to restock such item via email or going to my local costco store. Yes, I am a costco member.",1.0,1,1
Costco,1623423967,nxi54y,Car buying,Hello! I am looking into purchasing a new car and i reading up about Costco’s car buying program. I was curious if anyone here has used it and could give details as far as savings and their overall experience.,1.0,1,3
Costco,1623422256,nxhh61,Can all Costco optical departments access my prescriptions?,"I’m wondering if I visit an optical department while out of town, could the out of town store access my eye prescription? I bought glasses and contacts through Costco less than a year ago.",1.0,1,6
Costco,1623418414,nxg3g5,Costco optical/ Eyemed claim,"Eye med doesn't have Costco. It has to be out of network.

For glasses eye, med requires every line item like single vision, anti-reflective coating, UV, scratch coating, polycarbonate as line items for them to cover it whereas for Costco it is the standard default and is not a line item. What's the best way to get glasses through eye med from Costco. I love the range of frames that they have.

https://preview.redd.it/zrlvpc8z1n471.png?width=1096&amp;format=png&amp;auto=webp&amp;s=76fea1cee971c164d791b2774db5a9762656ff95",1.0,1,7
Costco,1623387374,nx7qo4,Regarding a possible two weeks notice.,"Greetings fellow Costco employees,

I have been working at Costco for almost a year now (10 months) and have been greatly enjoying my job, even if it has been part-time. 


I’m looking into putting in my two-weeks notice however, as I am getting interested in a different job that may have room for growth in a field I am interested in. 


What I want to know is if I decide to put my two weeks notice in, when is a good day to put it in and who do I give it to?


If it helps to know, I have a very good relationship with all my managers/supervisors. I’ve done my best to work my butt off working in the front end and have even helped a tiny bit with morning merch (enough to be offered a position). I think I may have one tardy, but as far as I know I have no write ups or counseling notices. 


I would like to leave in a manner that is professional and in a way that would allow me to return to Costco if I find that is something I need to do.",1.0,2,14
Costco,1623385753,nx7afz,Does Costco hire homeless people?,I'm going to be homeless soon in California -I'll move out there from Florida- and would like to know if that condition would make me an unacceptable candidate right off the bat,1.0,4,33
Costco,1623383814,nx6pzx,If you work for Costco and it's not in California or New York you're pretty lucky. Most likely you are a home owner that could afford a home all on your own or you never have to worry about rent and never have to worry about money issues,[deleted],0.4,0,2
Costco,1623380124,nx5m6a,Costco Coupon Code ($50),"An exclusive one-time use coupon code just for you  $50 OFF  a purchase of $500 or more on Costco.com  Enter Promo Code During Checkout  EY3XMCC  

Only valid on Costco.com. Not valid in warehouse. One coupon code per Costco member. Ineligible purchases include: new Costco memberships, Costco membership renewals, gift of membership, Costco Shop cards, custom installation services, Same-day grocery delivery, and online-digital print orders. Not valid for orders at the online Pharmacy, Costco Travel or Costco Business Delivery. The merchandise total in your cart must equal $500 or more before tax and shipping to receive the $50 off. The coupon code must be entered in the promo code box at checkout to be valid. This offer may not be combined with any other offer or promotion. Offer expires 6/13/21.",0.2,0,0
Costco,1623378445,nx53xu,Transfer Request,"So my wife has been promoted within her company but they're relocating us to another nearby state. I've been a Costco employee for 13 years, topped out, and full time. I do not want to even consider quitting but I've sent transfer requests to 3 different warehouses in the area we will be and I can't even get someone to call me back when I leave a message for the GM. One of the warehouses flat out told me no positions and not to call back.

I've even sent an email to the VP of the region to try and get some help but I haven't heard back from him either. I don't want to be rude but for a 13-year employee, I would think someone would at least try to make something happen.

What else can I do?",1.0,2,11
Costco,1623377357,nx4rxe,The Kimchi has changed.,"Recently, I purchased Kimchi from my local Costco - something I do regularly. But this most recent batch of kimchi tasted different than normal. I noticed that the recipe tasted much sweeter than the previous kimchi’s I have purchased from Costco. Has anyone else experienced this?",1.0,1,19
Costco,1623376558,nx4j8g,Minimum Door Width on Furniture,"Does anyone know if Costco would happen to know minimum door widths needed for furniture, specifically sofas?

I was looking at the Annadale Fabric Sectional but I do have to fit it through a narrower door and the website doesn't list a diagonal width. I'm going to call tomorrow, but I don't know if anyone on here has this sofa and how wide their door was. Mine is 29"" wide so I'm doubtful this would fit, but the couch would work really well in my basement so I was hoping it would.",0.67,1,10
Costco,1623373102,nx3gam,Lime Crema Shelf Life,"Quick question for those who've bought it before, what's the shelf life supposed to be for it? I bought a 2-pack yesterday at my local Costco and when I used it today I noticed the best by date was today. I'm going to see if I can return it tomorrow but I really wanna know if I got a one off or do all the bottles have a small window to be used.",0.67,1,16
Costco,1623371757,nx3102,"KS Bar Soap (1397147) vs Olay, etc. ?","I’ve been buying Olay bar soaps for years/decades from Target but I’m seeing reviews lately that they maybe changed the formula. 

How is the KS Shea butter soap as a substitute? Is it relabeled Dove (which I think smells bad)? Any direct comparison to Olay?",1.0,1,12
Costco,1623362696,nwzvf8,chicken bakes: have they become skinnier??,I just bought my favorite Costco food court product but was really disappointed that it was much skinner today compared to even a couple of months ago. Has anyone else noticed this at their Costco?,0.5,0,15
Costco,1623362606,nwzu5w,"Can't seem to locate any Kirkland Signature Nature's Domain Canned Dog Food, neither on store nor online","Does anyone know if this has been discontinued? Went by the local Costco today and they didn't have any at all, and there wasn't any available to order online either.",1.0,2,6
Costco,1623361605,nwzg5o,Just Received Member-Only Savings Ad for 4/14/21 -5/9/21 in the mail today,[removed],1.0,1,2
Costco,1623360378,nwyzf8,Cannot view my online schedule,"When I go to ESS &gt; payroll &gt; Online Schedule, it says my credentials are invalid when I try to log in. What's weird is that on the previous page, it says to enter the same username/password as my ESS to view my schedule which I'm doing exactly that, so I have no idea why it's giving me this error.",1.0,1,6
Costco,1623360280,nwyy3p,Cake,So my daughter is allergic to dairy and eggs but can have baked goods containing dairy and eggs (kills the protein when baked). Anyone know if the frosting they use contains dairy or egg? Tried calling but no one picked up.,1.0,1,8
Costco,1623357622,nwxwgq,Bakery folks: do you know if the cream berry pie is returning this year?,"I don't think Costco sold it last year. It usually comes end of June and lasts until July 4th and then it's gone. It's like a graham cracker crust with custard and topped with berries, it's absolutely delicious! Hoping to see it this year",1.0,3,5
Costco,1623353889,nwweox,I have a $50 off of $500 purchase from costco.com that I will not use. expires 6/13,"Here's the email in case anyone wants it:

An exclusive one-time use coupon code
just for you
 
$50 OFF
 
a purchase of $500 or more on Costco.com
 
Enter Promo Code During Checkout
 
BN7C98A
 
Only valid on Costco.com. Not valid in warehouse. One coupon code per Costco member. Ineligible purchases include: new Costco memberships, Costco membership renewals, gift of membership, Costco Shop cards, custom installation services, Same-day grocery delivery, and online-digital print orders. Not valid for orders at the online Pharmacy, Costco Travel or Costco Business Delivery. The merchandise total in your cart must equal $500 or more before tax and shipping to receive the $50 off. The coupon code must be entered in the promo code box at checkout to be valid. This offer may not be combined with any other offer or promotion. Offer expires 6/13/21.",0.6,1,71
Costco,1623353633,nwwbq6,Costco travel wtf,"I have done several trips through Costco travel, including one in February. I currently have two trips booked and had minor changes to each of them I've needed to make. 

I called last week and was on hold for 45 minutes, which I accepted as in the 2020 and beyond world, this is common.

Today I went through all the prompts for my Costco travel, and at the final one they said they would not be taking calls?!? To try again another time  This was for a Mexico trip for a US member. No hold option. No call back option. 

I expect this level of service from many companies, but not from Costco. You should at least be able to leave a message / call back info.",1.0,2,2
Costco,1623349385,nwum2p,How long do I bake a frozen chicken bake?,"So I've bought the frozen chicken bakes from costco, and when I looked at the baking directions, it does not list baking instructions for a single chicken bake. I tried searching it up, it didn't help. Does anyone know how long to bake it?",1.0,1,7
Costco,1623346595,nwthsd,Looking for a position in Costco as a cashier!,[removed],1.0,1,4
Costco,1623343745,nwsck3,"I understand the cost advantages of purchasing products in bulk though I really would appreciate if Costco provided its small family-type members the ability to purchase short-life products, such as fresh produce, in a smaller bundling.",[deleted],0.33,0,8
Costco,1623342529,nwrv8h,Just bought an air fryer! Finally going to try the Bare chicken nuggets for dinner,Going to Costco today if anybody has any air fryer tips or other food recommendations that we should pick up to make in there :),0.5,0,22
Costco,1623339902,nwqto1,Transfer pay after moving from full time to part time,So I'm transferring in a couple weeks from a fulltime forklift driver in New York down to a part time forklift driver I'm north carolina. I'm topped out. Do I keep my same pay rate. And benefits and vacation and sick time accrued?,0.5,0,6
Costco,1623301356,nwfjer,Costco car program,How does the Costco car program work? Is the pricing they give me set and non-negotiable?,1.0,1,3
Costco,1623298453,nweqms,Anyone purchased the Type S wetsuit seat covers?,"Can't find many reviews online, so thought I'd ask here. Saw these in store and liked the material, but didn't buy then. Anyone have a review for these? 

[https://www.costco.com/type-s-wetsuit-seat-covers-with-antibacterial-technology%2c-2-pack.product.100729432.html](https://www.costco.com/type-s-wetsuit-seat-covers-with-antibacterial-technology%2c-2-pack.product.100729432.html)",1.0,1,11
Costco,1623297028,nwebmy,Watching members pick out chickens,"Look i get that they pay for it and that fresher + bigger is nice but godd I want to die when *everyone* is rotating and shoving birds, swapping out 3 from their cart because they found a ""better"" one, not believing me/not caring when I tell them that the last oven was 10 minutes ago, putting back a chicken they took an hour ago to stare at me as I take out the fresh ones and then throw theirs in the trash. Like taking new ones screws over the employee and people after them who get old ones. It just feels so inconsiderate but that's probably an employee thing😥

Just wanted to rant thank you",1.0,1,105
Costco,1623296201,nwe36g,Where can I give the best compliment? Looking for an employee response if possible,"So i had a tremendous experience with the optical tonight after have a disastrous one at another location. This lady not only fixed my glasses but spent so much time with me that i felt so good about what had been done and the advice she gave. So i had asked her, where can i give a compliment because i know those go a long way with some company's. She advised the box in front of the store and I did that. I always feel there's more and she certainly deserved it, is there anything higher I can put in for her or is that ""good enough"".  I did go to the website but the feedback tab didn't bring me anywhere( i had hoped i could leave a long explanation then the little paper allowed lol)",1.0,1,13
Costco,1623295388,nwduly,Banned from returning online,Has anyone ever been banned from using the self service online returns but ok to return in store,1.0,1,7
Costco,1623292869,nwd2uz,How does the Allstate 3 Years Plan work with Costco Concierge 2+2 Warranty?,"Normally when you buy an appliance, Costco extends the mfgr warranty to 2 years, and the Allstate plan covers Years 3-5.

With the Costo Concierge 2+2 Warranty when paying with the Costco Anywhere Visa, Costco is extending your mfgr warranty to 4 years total.

In this case, does the Allstate plan cover Years 5-7, or does it simply overlap and expire after Year 5?

&amp;#x200B;

[Costco 2+2 Warranty](https://www.costco.com/concierge-two-plus-two-warranty.html)

[Allstate 3 Years Plan](https://www.costco.com/.product.1059340.html)",1.0,1,3
Costco,1623290029,nwc6d8,Kirkland Chocolate Sauce from food court,Anyone know the brand of chocolate sauce they use on the Chocolate sundaes at the food court?,1.0,1,5
Costco,1623286654,nwb3u2,Does anyone else get the Just Bare frozen chicken nuggets?,"These were great when I first started getting them but the quality has been extremely hit or miss lately. Some bags are super dry and others barely breaded at all, each bag looks like a different product.

Anyone else out there that has noticed this? These used to be soooooo good but the quality drop has been crazy.",1.0,1,22
Costco,1623286148,nway01,"I have an upcoming interview, and have some questions about what it's like to work for Costco","Main thing is, should I?  
I am told they only hire part time, and the information I see online is vastly different from one source to the next.   
Some websites say I'll make $20 an hour, others say as low as $12. And none say what the average part time hours are.   
I'm sure it's different from location to location, but mainly I need to know if I can continue to make what I'm making at this new position.",1.0,2,6
Costco,1623285504,nwaqdd,Serious questions about Furniture and Appliance orders for shipping,"We're having a house built and it's slated to be finished on or around 8/26. When it comes to things like the King Bedroom Sets, do I need to put all the items together myself? 

I'm slightly freaking out. This is so much. We're going to be a lot more broke than we thought. With work getting slowed so darn much from COVID to the chip shortage we're going to have damn near nothing in our savings when we move in.

So the home we rent now is a 3 bedroom 1 bath at 925 sqft. The home we're having built is 2227 sqft. We don't even come close to having things to put in it. 

We have two young boys. We are good on their stuff. We need a bedroom set. Also the sofa we have now is beyond dead and the only reason we haven't gotten rid of it is because we need to save as much as we can to throw at the downpayment, closing costs, ect. 

So we have a living room set on order at a furniture store here in town. It's 3 pieces, two sofas and a char. We put down $600. I think the set was slightly over $2600. We're going to have to cancel that now and we'll lose $100 in breaking the agreement but we can't do that now. We'll be $3k off what we thought we would have. And that's the best case right there.

But our credit card is empty and we always report a zero balance. We only use it for things we are already going to buy just for the rewards and pay it monthly. So when we get in we can get our bedroom set and then pay it off and get a living room set.

I'm also going to need to do a washer and dryer and wonder if they will deliver it upstairs where the laundry room will be. 

Idk I made this post because I'm just freaking out and this sub is really great and helpful. And I'm sure some of you understand the position I'm in and I'm hoping to get some good insight into something I may have overlooked. 

When you have so much to think about you are bound to overlook something that should have been obvious.

Also, if you have nothing nice to say then skip this. This isn't me crying or looking for pity. Just a Dad who is stressing. We all go thought it.",0.5,0,1
Costco,1623281122,nw9bay,Why is my internet connection always really weak when I go to Costco,Is it just me?,0.5,0,5
Costco,1623280916,nw98u8,"Out of this world amazing service at Santee (San Diego) Costco Tire Center, Thanks Rami!","I'm going to leave out a lot of details about how I got into this fix but I needed new tires for my trailer wheels. I had no idea I'd wind up at a Costco at 5pm on a Sunday evening as they were closing the Tire Center.

Rami, who might be a supervisor, looked for appropriate tires and showed them to me. Then he said he'd try to get approval to mount them after hours. Well time dragged on as my son and I had difficulties finding a way to pay for the tires. **Nota Bene!** Costco  does NOT accept Master Card debit or credit cards! That was all we had between us, a couple each but all Master Cards. Also, the ATM inside the store, which Rami got us access to, doesn't work with Master Card debit cards, my son was unable to get cash. Strangely, when I later tried with my European debit card (Master Card), I was able to get cash.

So the tires were paid for and a very (extremely) patient Rami and his associate, whose name I unfortunately did not get, mounted and balanced the tires and all work was finished pretty close to 6pm. Amazing!

Of course I tried to give them a tip but they refused saying something about a fine (or did he say fired?) if they accepted. He asked me to leave a nice review instead - no problem!

I'm posting it here because I think more people will see it than on Costco's site but I'll copy it there also.",1.0,3,9
Costco,1623277599,nw84jx,How do I deal with a bad forklift driver?,"I work am merch and have to work with a fully incompetent driver now that my regular driver is on vacation. This driver doesn’t drop the things I ask for, doesn’t help anyone but his spouse who is in the same area, talks down to people, drives around telling people he’s “the best driver at the warehouse”.

I’m thinking I can do petty things like stop stacking my boards and wrap my boards not quite down to the pallet. Or just be a complete piece of shit and slack off when he’s my driver. But what I’d rather do is to not be petty and not be a piece of shit and have him not drive for me.

What can I do?

Ps. This is also after I tried being the bigger person and talked to him to try and get on the same page. But was met with an obstinate, shitty, and pouty attitude.",1.0,1,25
Costco,1623275336,nw7b4e,Which fancy rice cooker?,"Local Costco has the Tiger JBV-S10U available... but online I see another Tiger model JBX-B10U as well as a Cuckoo CR-0632F. They all are about the same price, so I guess the question is - does anyone have a recommendation amongst these?",1.0,1,28
Costco,1623273500,nw6mt0,Never again will I order from Costco online.,"I have had a broken dishwasher since April with 3 failed delivery attempts on the replacement. I get an average of 3 robo calls the night before each time. No apologies, no offer of compensation, no solutions - just passing from one company or dept. to another. I told them to cancel and come get the broken one - they refused! I had to threaten a chargeback and throwing the damn thing into the street before they would magically organise the pickup. They also double charged me 200 dollars for another order they said they'd cancelled but didn't.

Total time wasted: 5+ hours on hold and talking to people that just have a script and never deviate. Even the managers.

Never. Ever. Again. will I order from the Costco website. I only wish I'd seen others' experience before doing so.

Order now in with Lowes because I can go see it and confirm stock in the store.",0.5,0,21
