subreddit,created_utc,id,title,selftext,upvote_ratio,score,num_comments
Costco,1620931279,nbnxfq,Infinity Bike?,"Saw Costco has an infinity bike for 219USD, was just wondering if anyone has any reviews / experience and if they were able to put it together themselves as the box says I should go to a bike shop.

It seems like a fair deal for a bike that will be just used around the neighborhood? I want a road bike that will cost like 800+ but figured I can get a casual bike too(and there's a bike shortage atm)!",1.0,1,2
Costco,1620929056,nbn0xf,Costco tire order question,"I ordered my tires on May 3rd, website says “shipped” on May 5th. The tracking link doesn’t work, it’s some Michelin Warehouse reports URL. Customer service and Tire center says that they can’t access the tracking URL and suggested me to wait until tires were delivered at tire center. Is this normal?",1.0,1,4
Costco,1620928823,nbmxmz,Sperry Boat Shoes?,Last year Costco had men’s Sperry shoes for less than 1/2 the normal price ($40 vs $90-$100)... anyone have any idea if they’re going to carry them again this year?,1.0,1,4
Costco,1620924720,nbl8l2,Cariloha Sheet - SO DISAPPOINTED they SHRUNK!!!,[removed],1.0,1,3
Costco,1620916305,nbhzij,UK resident,I am a UK resident and i just wanna shop in store and go to the food court but i’m just an average person which membership would i get?,1.0,1,3
Costco,1620915431,nbhnvl,Household member change,"If I change the household member does that eliminate any executive rebates earned by the previous cardholder? The terms state ""Only purchases made by the Primary and active Primary Household Cardholder on the account will apply toward the Reward"". This implies to me that only the person who has a card at the time of renewal will be counted towards the rebate.",1.0,1,17
Costco,1620911013,nbg589,Gin,I’m a big fan of the Costco Kirkland gin. However the last couple times I’ve been at my local Costco in Washington DC I can’t find it. Does anyone have the scoop on this?,1.0,1,5
Costco,1620889957,nbarlb,Executive membership?,[removed],1.0,1,25
Costco,1620886037,nb9upk,Kirkland Greek Yogurt 12-packs?,"Flavors were lemon, cherry, and vanilla. Bought these about a year ago and they were the best tasting yogurts I ever had. After that first time purchase they completely disappeared and I've never seen them again. Have checked multiple locations too and nothing. Did they discontinue them?",1.0,1,1
Costco,1620883182,nb960g,Where is fresh king salmon and salmon rub?,Have not seen it in any Costco this year. When is it available?,1.0,1,1
Costco,1620876530,nb7ekq,Did Costco permanently discontinue block American cheese?,"Kraft American cheese slices worked in my house for many many years. Convenient and familiar.

A couple years ago I bought the Kirkland (I think it was Kirkland) American cheese. Not individually wrapped, but was sliced and staggered for easy grabbing of a slice.

OMG so good. So much BETTER than Kraft!

…and then? Gone. I was told it’d be coming back, but… never seen it. 

Anyone know the story on the cheese?

(In SoCal, if it matters)",1.0,1,7
Costco,1620874804,nb6ux1,I love Costco but this sub is full of cucks.,See title.,1.0,1,1
Costco,1620872987,nb6adn,Beans?,Have there been black beans since the recall? I couldnt find any at my costco,1.0,1,10
Costco,1620872637,nb66eb,Question about dishwasher delivery,"Just ordered a dishwasher online. The order page indicates that after the delivery appointment, ""2nd appointment required to install dishwasher or microwave and in some areas gas appliances."" But it says nothing about when that appointment would be, how to make it, etc...

So I called the Costco concierge service and the person there told me that a second appointment is *not* required for a dishwasher ""unless they can't fit it into the space or whatever.""

So now I'm totally confused.  Can experienced Costco dishwasher recipients fill me in here? How does this work?  In particular:  

(1) is it one appointment or two?  

(2) If two, how/when/with whom do you make the second appointment? 

(3) Is it my responsibility to detach my current dishwasher so that it's ready to be carted away?

(4) If the answer to (3) is yes, and the whole process requires *two* appointments, must I detach my current dishwasher before the **first** or the **second** of the two appointments?

(5) Why on earth does the Costco online ordering experience not explain this process? (that question is rhetorical...)

Thanks!",1.0,1,8
Costco,1620866804,nb482k,Gazebo 12x16,[removed],1.0,1,6
Costco,1620864099,nb3a4n,"Confiscated Costco card...I'm out of state, how do I fix this?",[removed],1.0,1,9
Costco,1620860727,nb23tg,Quinoa Discontinued?,"I've been to my local Costco (Brooklyn, NY) three times in the past week and noticed no more Kirkland Organic Quinoa. Anyone know if this item has been discontinued or simply out of stock for a whole week? Seems odd since never happened with this item.",1.0,1,3
Costco,1620860430,nb1zqc,Does Costco still require masks in states that don’t have a mask mandate?,,1.0,1,18
Costco,1620860166,nb1wbv,Costco charges for SIMs now with a new T-Mobile account?,"I was surprised that they charge $7.50 now. This is apparently as of 2 days ago...? Anyone else heard of this? 

I understand if someone loses their sim or damages it and just walks in wanting a replacement SIM card, but I'm surprised that with a new wireless account signup it's not included anymore...",1.0,1,6
Costco,1620858495,nb19on,Costco Delivery Number Never Picks up,"Trying to contact the number (877-895-4093/888-803-3459) provided in the delivery notification email for a [costco.com](https://costco.com) order and these guys never pick up!

The recording said a wait time of ""4 minutes"" and I've been on hold for 2 hours and 30 minutes! Anyone have any tips?",1.0,1,1
Costco,1620857310,nb0tyo,Sweet Karoline Blackberries,"I bought it was and amazed at how sweet these are!  I'm not a blackberry fan, but I could buy and eat these again, it has a delicate sweetness and none of the tartness.",1.0,1,5
Costco,1620855343,nb03xn,What are the best ice creams you can buy from Costco?,Never bought ice cream from Costco so I'm going to give it a try when I go later.,1.0,1,24
Costco,1620851695,nayp62,How is the brisket? Save a few bucks/lb on Costco or get my normal butcher cut?,"I'm going to be smoking a brisket this weekend, I have a great butcher I usually get my brisket from but I'm considering a Costco cut because I need more than usual. I don't want to wasted 12+ hours smoking and end up with a subprime brisket just to save a few bucks. I think my brisket pretty wet. What do you smokers think?",1.0,1,22
Costco,1620845134,naw5c2,Beef Tenderloin goes from $27.99 /kg 5 weeks ago to 40.99 /kg today.....,"I shop weekly here in Calgary, at my east hills Costco, and I'm at a loss as to why this ~40% increase in price? No other meat has increased more than 10%, yes I check every week, the tenderloins are up every other day. I buy chicken breast and pork weekly, and check beef prices and take notes.

 It makes no sense other than seasonal gouging because CAD is up, this is non cut, non denuded, and is supposed to be wholesale, and comes from excel meats which is very close so shipping isn't it, its not coming from USA, I just don't get it, anyone care to explain?",1.0,1,5
Costco,1620833441,narh4a,When will Costco start permitting the return of food and/or health and beauty products?,Sick of saving half uses items at home :),1.0,1,30
Costco,1620827440,nap4wo,How long can Costco cakes last in the fridge past their sell-by date?,,1.0,1,8
Costco,1620823311,nanqi5,You know you're a Costco shopper if.....,"* You have a hand truck/dolly/heavy-duty cart for taking the grocery and other goods from your car to your house.
* You coordinate your return time with family/roommates so they are there to help unload.
* Your dog automatically knows it is getting a new snack and/or toy.
* You have a vacuum sealer for food storage of perishables bought in bulk.
* You have a pre-shopping caffeination strategy.
* At least one pair of shoes are your preferred ""Costco shopping shoes""

What are your signs you are a Costco shopper, or what do you differently when shopping at Costco compared to other stores?",1.0,1,9
Costco,1620820207,namrpt,Spent $6k but only have $33.13 in rewards. Can't get help from Costco customer service. Can someone help?,"I am facing a rare issue, getting customer service from Costco. I have gotten only $33.13 after spending over $6k. Feels like I have exhausted all my options to no avail. But firstly want to say I have been a executive member for almost 3 years now and got the Citi card and love it. 

 

 It all started 3 months back. I saw that I had only accumulated $4.15 for the last 10 months. My Citi card had $85+. So I went to the customer service counter and they couldn't explain it at all. They did some looking around and found out we had spent about $4500 in the last 10 months.  Then asked me a few questions. ""Did you buy a lot of gas?"" no, covid working from home. ""Have you been returning a lot of items?"" nope. The folks behind the counter talked within themselves for a few minutes asking each other questions, gave up, took my number told me they will reach out to their manager and get back to me. 2 weeks passed nothing.

&amp;#x200B;

So I went in again, this time some other person was there. He asked the same questions. Again took my number and said he would call. I asked if I could get some kind of a service request/ ticket number he said no. It has been 6 weeks, haven't heard anything.

&amp;#x200B;

While I was waiting I also called the customer service number. Told them what happened, same questions. They said they will do an investigation. Again I asked if I could get a ticket/service request number. They said no but they also said they will update my account profile and would receive an email. Haven't received anything not even a email confirmation.

&amp;#x200B;

Does anyone know how to get help on this issue? Thank you!",1.0,1,29
Costco,1620807024,najjla,New here lol :),I'm a new member to costco but I was wondering if you guys sell sports cards ?,1.0,1,1
Costco,1620805426,naj6nx,Product availability online if not in store?,Are all products you guys find available to order online if they're not in my store?,1.0,1,2
Costco,1620797150,nah919,Weird job interveiw today.,"I went for a job interview fir a deli position at a costco today. The interviewer asked me if I would be willing to work a shift from 6am to 12midnight. I thoight that was a bit silly, so I asked him to clarify and he ment would I be willing to work the more than 12 hour shit of 6am to midnight straight. So I tell him that I would do it in an emergency situation, but no. And he then asked me if I would take a full week of that schedule. To which I say no. I would not. He then tells me that despite this being a part time position with no intent to ever give me those kind of hours that I am not suited for the job because I am not willing to ""do whatever it takes"" so like wtf I didn't get the job because I didn't lie about the hours, because no one is going to work those hours for 15 an hour. Why even ask me about something that extreme if its for a part time position. Anyway I contacted corprate. I am also reserching to see if this qualifies as a form of discrimination do to it being blantently illegal to work those hours to begin with.",1.0,1,118
Costco,1620784600,nadphj,[Kiosk Manager] Good company to work for?,"I currently work in National Retail for a competitor, and was offered the Kiosk Manager position for Wireless Advocates. Many people I talked to over the last few days have given me both pros and cons for staying or leaving my current company, so I thought I’d ask actual employees what their thought on the company are.

Things that are drawing me to Wireless Advocates:

- Higher base pay. Was offered $15/hour, currently make $11.

- Potentially higher opportunity to make sales with Wireless Advocates offering all three carriers. Comparably, my company only offers one (AT&amp;T).

- Potentially better inventory and opportunity to advance.

Some questions I had:

1. What are sales metrics like?

2. How busy are the kiosks, and will a large portion of the job consist of actually “finding customers?

3. If you have an off month, will you be threatened with termination?

4. What are average commission checks like, and how easy is it to make commission? 

My company defines highly productive sales people as making $3-$4 an hour in commission. The person I spoke with at Wireless Advocates told me he defines that as “mediocre”. 

5. Overall, how is the company to work for?

I would appreciate if anyone could help me make an informed decision.",1.0,1,0
Costco,1620782154,nacxm5,Lifeline utility shed,I just got the 6x4 lifeline utility shed and am having trouble with one of the firsts steps. Anyone else have a problem with building it?,1.0,1,9
Costco,1620775086,naan7m,Insurance experience,Anyone purchased homeowners insurance through Costco (connect)? How has your experience been and how does it compare to any other carriers you've had in the past? Have you filed claims with them before? How was that process?,1.0,1,6
Costco,1620774707,naailk,I’ve found a job posting for a “Logistics Clerical” position and was wondering if anybody on the sub could please explain what they know about it,The job description is pretty vague and doesn’t seem to give me a whole lot of insight as to what the duties are. I am looking to apply because I’m looking to garner experience in logistics but i am curious about what I would be doing on a daily basis. Would i be working alone or with a group of other individuals? Anything helps,1.0,1,6
Costco,1620771966,na9joe,Wilson Badminton set disappointing,"I'll be returned the badminton set. The rackets and birdies are great, but the poles and net seem likes it's quite short.",1.0,1,6
Costco,1620769735,na8pp5,Costco installer question,"Hello,

I was wondering. How do installers for Costco get paid. Do installers get paid by field service calls?

I recently purchased a kitchen appliance, which came with free installation.  I got a message from the installer to set up an appointment for the installation. I honestly can install the appliance myself but am I basically taking away from some guy's paycheck if I do so?",1.0,1,3
Costco,1620766651,na7j20,What does cross training mean?,I was hired on for front end and have worked there for almost a month. Yesterday I was offered to cross train on morning merchandising. Does this mean I’ll temporarily be doing that until I learn what there is to do and be able to go back to front end? I plan on going back to school at some point during the next academic year and morning merchandising wouldn’t work with my ideal school schedule.,1.0,1,7
Costco,1620759419,na4l7j,Costco Travel - Skipping rental car with a hotel package?,"Has anyone skipped getting the rental car when you buy a hotel + rental car package through Costco Travel? 

I'm headed to San Francisco in September and CT is offering a really crazy rate on a Marriot + rental car. As this is San Francisco, you don't really need a car to get around plus parking that rental car is gonna cost somewhere around $50-100 bucks a night and I'm 99% sure the parking cost is not included in the package. 

So will you get penalized if you skip getting the rental car? 

I ask because I've been charged by these rental car companies before even though my flight was canceled and it was such a pain in the butt to get them to waive that charge. I also tried getting on CT's phone support but there's a 2 hour wait time right now. 😬

Thanks!",1.0,1,22
Costco,1620754952,na2sj6,Review and Tardies,"Just had my 1 year review, and it was good, except that I have had 6 tardies throughout the year. Would this kill any chance of me possibly getting a transfer to another warehouse?",1.0,1,6
Costco,1620752695,na1vje,Generac Whole House Generator,"I just requested a consultation with whatever company they've contracted with for purchase and installation, but I was curious if anyone here had gotten one through Costco and had feedback. Thanks!",1.0,1,13
Costco,1620751116,na18ry,Does Costco personalize round cakes?,"I always see a couple of “happy birthday” round cakes ready to go at Costco, but can you personalize one of those the way that you can a sheet cake? I’d like one with the rainbow design and hopefully my son’s name.

Also - he keeps changing his mind about whether he wants chocolate or vanilla (he’s turning 3 lol). Which one would be the biggest crowd pleaser? I’m thinking vanilla? I’ve been a Costco shopper for years but I’ve never had the cake before! 🙊",1.0,1,8
Costco,1620746026,n9zb0u,What’s the best purchase you’ve ever made at Costco?,,1.0,1,100
Costco,1620745448,n9z2qr,Is it possible to convert online order to store?,"I ordered something on sale ($85 off) online, and the item is backordered. My local store has the item in stock, but I don't want to lose my savings. Is there any way that I would be able to convert my online order to pick it up in store, or do I just have to wait for the item to go back in stock online and have it ship to me?",1.0,1,6
Costco,1620744861,n9yulp,Olive oil???,[removed],1.0,1,17
Costco,1620732567,n9uuwi,Costco Story,"THIS IS FOR COMEDIC PURPOSES ONLY, NO HARM INTENDED TOWARDS COSTCO

So I was at Costco the other day, minding my own buisness. I finished shopping and went to the checkout lines. I don't know how your local Costco is laid out, but for ours, the technology section is a few steps away from the checkout lanes.

So my kids (12 and 9) went to go to the tech section after asking mew permission to go and see some new devices. So I just sat there in line watching them to make sure they were ok. 

Now I was carrying 3 of those larger carts full of those like 8 feet tall bush tree things, I was in the process of re-landscaping. So as you could imagine, it wasn't too easy trying to push 3 carts, watching the line, and watching my kids. 

Just so you know, dear reader, I speak Romanian. 🇷🇴 I lived in Romania until I was about 25 years old, so English is my second language, I am more fluent in Romanian.

As I was in line, pushing carts, watching kids, whatever, I hear a bratty middle aged woman say, in Romanian, ""Hai să mergem la altă linie, crețul ăsta s-o pus să doarmă în picioare"" Which means ""Lets go to another line, this curly haired freak fell asleep while standing in line.

At that point, I should have said something like ""Why thanks for waking me up"" or ""man, I'm lucky you were here to awaken me"" but I didn't, I just stayed there. After around 30 more seconds, I called for my kids to come back, in Romanian though. 

I hoped the woman had heard me. 

At that point idk who was dying inside more, me or the woman lol

The thing is though I do that all the time, use my native language to trash people out in public",1.0,1,50
Costco,1620732488,n9uu6i,Costco Story #1,[removed],1.0,1,0
Costco,1620712129,n9q0es,Is the new Apple TV removed from inventory?,"I saw the new Apple TV listed on Costco online for purchase and was so excited! And I search for it today again, only to find “Product Not Found!” Webpage with a teddy laying on Kirkland water bottle stack 😅. Anyone else run into this?",1.0,1,13
Costco,1620699056,n9mes5,PreGra Artificial Grass,"A few weeks ago one of my local Costco (Tucson, Az) has/had 5x7 PreGra artificial Bermuda grass. Has anyone purchased this? Is it worth it? 

Also if anyone is in Tucson, do you know if it’s still there? Costco’s website is extremely unhelpful.",1.0,1,1
Costco,1620698715,n9mawr,"Looking for a treadmill, does Costco offer free delivery and assembly?","Hi, 

I am looking for a treadmill. The model I am interested is not available in the manufacturer website but it's available in Costco. Also I am not sure if it is free delivery and installation. 

Wondering what will happen if the warranty expires etc. 

Is it a good idea to buy from Costco or but the model that is available in manufacturer website?",1.0,1,6
Costco,1620694983,n9l3md,Junior’s NY Cheesecake,"Is back in action, bought 1 tonight for $14.99, 8” cake, 3 lbs",1.0,1,4
Costco,1620693311,n9kk5n,Did Costco stop selling Nutrisystem Gift cards?,Normally you can buy $100 nutrisystem gift cards for $80 and sometimes as low as $59.00 but now they are just gone?,1.0,1,4
Costco,1620692292,n9k8si,Did Costco Photo Department discontinue selling famous works of art for printing/framing or on canvas?,[removed],1.0,1,3
Costco,1620691098,n9jue9,"What is with Costco's ""donate to our local children hospital"" shilling?",[removed],1.0,1,10
Costco,1620690389,n9jm6x,Cold Brew Coffee,"Is the Kirkland brand cold brew have a real strong coffee taste?  Not a coffee drinker, prefer frappes but wanting to try cold brew.",1.0,1,8
Costco,1620689865,n9jfht,"Just got an interview, could anyone inform me on the process?","I am interviewing for a part time, front end position. If anyone is in this position, or knows about it, could you tell me what to expect from the interview, what I would be doing in the job, and what the starting pay would be (California)? Thanks in advance!",1.0,1,4
Costco,1620688527,n9iyko,Homedics Therapist Select Pro Percussion Massager,[removed],1.0,1,2
Costco,1620682869,n9gwpx,Crazy lady refusing to put out her cigarette at the gas station.,"I was at a Northern Phoenix Costco getting gas with my Mom when some older, grey haired white lady could be heard screaming ""I am an American!  You can't tell me to put out my cigarette!""

That turned into multiple staff arriving.  While I was driving away, you could see the male in the driver's seat and the female in the passenger's seat had purposefully pulled over and were berating the staff.  

I hope they get banned from Costco.  It was a super windy day.  I realize that an explosion or fire are rare, but why would someone feel like they had the right to put everyone in danger?",1.0,1,48
Costco,1620681697,n9ggex,Deli Prepared Kirkland Mac and Cheese longevity after sell by date,[removed],1.0,1,7
Costco,1620680587,n9g0wi,Flip Top Bins,"Am I hallucinating or did/does Costco carry the large clear storage bins with a black split flip open lid? I sear I bought one there recently but I can't find a single reference to them online except through the business center, which doesn't deliver to me.",1.0,1,6
Costco,1620679891,n9fqwc,How Come Costco never has Red Onions?,Those big sweet yellow ones are the only onions we have here (N. East USA),1.0,1,6
Costco,1620678800,n9fbn4,"No heinz ketchup, only hunts?","They're joking, right?

They had heinz in the pack with relish and mustard but beyond that only hunts. The fuck?",1.0,1,17
Costco,1620677727,n9ewej,The Ninja 9 in 1 air fryer/oven is on sale right now. Anyone have experience with it? Any good? I’m looking to replace the cuisinart model that I bought,"I have the cuisinart air fryer that Costco carries. It’s normally $200, so when I got it on sale for $140 I was pretty happy. 

The thing is it’s not very big. What’s the point of having a toaster oven if you can’t throw a frozen pizza in there?

Anyways, just wondering if anyone has experience with the ninja oven?",1.0,1,8
Costco,1620677584,n9euea,costco rewards not showing accurately ?,"checked this 2 weeks ago and it was accurate, checked today and removed the app re-downloaded to check again and it’s still incorrect ?",1.0,1,6
Costco,1620676229,n9eack,Costco switching from huggies to pampers,"Was at my local Costco this weekend and saw clearance pricing on huggies:

Huggies Plus Diapers Size 1 (192 Ct) - $24.97
Huggies Plus Diapers Size 2 (174 Ct) - $24.97
Huggies Plus Diapers Size 3 (198 Ct) - $29.97


On top of that, saw pampers diapers next to the Kirkland diapers for the first time",1.0,1,12
Costco,1620671746,n9chck,Buying appliances from Costco?,"We just bought a house and need to buy all large appliances. Fridge, washer, dryer, stove, microwave and dish washer. My first thought was to buy from Home depot or lowe's but i remember costco with citi card i can get 4 years warranty and i will have to pay extra in other places for the warranty. I have been reading  some negative reviews on delivery and warranty claims for appliances bought through costco . 

I also was able to find most of the models that i am interested is available in [costco.com](https://costco.com). 

Anyone has personal experience here buying from costco? Is it worth it?",1.0,1,25
Costco,1620669926,n9bqp2,Can we get more pictures of Costco from exotic locations?,Hi fellow Costconians! As a Costco fan I would love to see pictures of exotic locations or interesting items sold outside of North America! I live in boring Canada and have nothing interesting to offer. But i would love to see your shots.,1.0,1,12
Costco,1620669730,n9bnsb,Is it me or are the new soda lids horrible?,"1. Why doesn't it have a notch to hold the part where you flip? I've seen coffee cups with this design


2. The lid doesn't seem to fit snuggly. Any little movement will cause leakage where the lid meets the cup.",1.0,1,9
Costco,1620669438,n9bjj6,Total waste of time,[removed],1.0,1,0
Costco,1620666855,n9ago1,Returns on separate cards?,"My mother added me as a household member for her Costco card. I bought her a mother's day gift with my card and was wondering if she doesn't like it, can she return it using her Costco card?",1.0,1,7
Costco,1620666044,n9a42w,What frozen meals would you recommend?,I just bought a Costco membership and I'm wondering what frozen or prepared meals are a must at Costco? I've just been buying rotisserie chicken from there so far.,1.0,1,35
