subreddit,created_utc,id,title,selftext,upvote_ratio,score,num_comments
Costco,1619641623,n0nzbk,Sunvilla Patio Furniture,Was hoping someone could help me as I’m a bit new to Costco online. Had been looking for a patio set and identified an item I liked and both times when I went to purchase the item was gone. Not just out of stock but the item is no longer even on the website (from the time I hit purchase to trying to put in my card information). It was the Sunvilla Indigo 9 piece woven dining set - is there a way to see if this item is gone for good or if it rotates back into stock? Just frustrated as I know the inventory is quick but I had already put it in my cart to purchase. Have no item number unfortunately as when I click on the item it says the page no longer exists. Any help welcome!,0.99,1,3
Costco,1619638270,n0mrau,pizza!!,does costco carry the pizza they serve at the hot food counter?? like can i buy it and make it at home? tia,0.5,0,6
Costco,1619637839,n0mllf,Can I call out of a 5 hour shift with 1.4 hours of personal time and not get in trouble? Please answer fast. Thanks,,1.0,1,13
Costco,1619636311,n0m1gj,Why doesn't costco promote their smaller sales online?,Went to Costco today and they had a Cinco de mayo flier with discounts from now until then. But don't see anything online advertising it.,1.0,1,6
Costco,1619636257,n0m0qa,Professional (licensed) prints unavailable on costco photo anymore?,"Does anyone know if it's still possible to get professional/licensed prints from Costco photo center's website? 

You used to be able to search for places(Amsterdam, Vegas Strip) on their website and you would get tens or hundreds of professional photographs to choose from based on your query.  

Thank you I'm advance ! !",1.0,1,1
Costco,1619632821,n0krsv,Drug testing in Illinois,"I applied to Costco and I recently attended the second interview and they told me that they would reach out in a couple days if I'm fit for the position . I was told that there would be a drug test and background check screening in the 3rd interview and i was just wondering if Costco's in Illinois use spit or urine test. 

thanks!",1.0,1,9
Costco,1619631968,n0kgib,Naproxen / Aleve,"Significant other just back from costco run. Aleve was on sale ($5 off), so he bought a bottle. We haven't been able to find kirkland naproxen since before the pandemic started.

I looked at it because it was a bigger bottle. 160 tablets. Checked the smaller bottle from within last few months. It had 250 tablets. Thats like over 1/3 increase in price!!! Wow.",1.0,1,11
Costco,1619631035,n0k3yq,Had my third interview yesterday,"Hi everyone, I had my third interview yesterday and now I’m in that worried phase of getting a call back or not, lol. If only it was like getting called back for the third interview because they’d called me in 30 mins after 1st interview ended lol. I would like to think for the most part it went good and that my previous experience is gonna help me a lot. I have like 2 years of warehouse experience at and like 5 years in fast food experience so I hope this propels me thru. 

I told them what they wanted to hear about flexibility. I’d be there 4 or 5 in morning or the afternoon to work and am wide open. I know how to use a pallet jack already and have experience with pallets. That I had good evaluations from previous warehouse. The GM asked me about loyalty and told him I’d left my previous jobs on good terms because they’d respect me and i them and is about treating each other right. Mentioned I’d be committed and in it for the long run and really I think only 1 question were I’d stumbled on. They’d asked me about my weakness, which didn’t get asked in previous interviews and was at a loss but they asked me if good with multi tasking, priorities and stuff and told them absolutely because of previous job. 

The interview ended with, they’ll go thru the selection process and now I’m here waiting. I know just need to take it one day at a time but I’m hoping it’s a background check I’m waiting on and hope to hear something by Friday. I didn’t take no drug test or anything so I’m hoping when they call me back it’s for that because from what I read I know it’s done deal by then. What gives me hope is that the person before me interview lasted just as long as mine did but any words of encouragement or advice be appreciated and I hope for the best. Thank you.",1.0,1,6
Costco,1619630096,n0jrjk,Is this a reasonable return?,"I bought a power washer way back that I've probably used about once or twice a year - brought it out today and... it's dead (tried different outlets, resetting it, etc.)

I forgot entirely that I even bought it from Costco until I saw the concierge sticker, which has a 2012 date on it, so I'm assuming I bought it back then. Seeing as I've gotten little use out of it, but it's many years old, how much of an asshole would I be if I returned it (to buy whatever they carry now)? It's not a ton of money, but still...",1.0,1,5
Costco,1619626828,n0ij3d,"Pendleton National Park Collection Pillow, 2-pack (Review)","A couple weeks ago, someone posted asking if anyone had those pillows. A number of people chimed in asking the same question.  I bit the bullet and bought them, so here's information on them for anyone who wants.

https://www.costco.com/pendleton-national-park-collection-pillow%2c-2-pack.product.100752869.html

If you like not-fat pillows, these are perfect.  They're not much wider than the gusseted edge, and they're firm but not so hard you can't bend them and fold them if you want. (I sleep on my side and wedge them a little under my neck sometimes.)

I've been using them for five days now, and I'm going to buy another set so I have pillows on hand that work for me when this set wears out. (I have such a hard time finding pillows that are comfortable, when I find some that work for me, I like to buy extras.)

As for why they're a ""national park collection"", the colors on the side are the colors of (in this case) Pendleton National Park. Apparently the collection has other colors, but these are the only ones Costco carries.  (Edit: Since I ordered mine, Costco added three more color options!) Also, some money from each purchase is donated to the parks.

While these get a big thumbs up from me, pillows are a really personal item.  If you like a not-fat, solid pillow, check these out!  Side sleeper me loves them.",1.0,1,11
Costco,1619615749,n0ek0h,Costco cat towers,[removed],1.0,1,1
Costco,1619615653,n0eiyz,Keto friendly items,I am looking to start a keto diet and I want to know what keto items are you able to find at Costco?,1.0,1,15
Costco,1619615214,n0ee0u,Question about squaretrade warranty,"Hi all,

I am in the process of buying some appliances from Costco and planning on getting additional warranty via squaretrade. 

How hard or easy is to use/claim warranty when using squaretrade. Does costco handle that or is it third party repair shop that handles it?

And if I may ask - any fridge and washer/dryer combo you recommend at costco that will last longer (5-7 years) and don’t die with a year or two?

Thanks!!",1.0,1,3
Costco,1619613939,n0dzx7,Are external hard drives covered under the 90 day return policy or the general return policy?,,1.0,1,8
Costco,1619613661,n0dwu1,Shimmering Leaf Stakes - love these in my yard,"If you're looking for some yard art, check out the shimmering leaf stakes available on the website. 

[https://www.costco.com/shimmering-leaf-stakes%2c-5-pack.product.100707206.html](https://www.costco.com/shimmering-leaf-stakes%2c-5-pack.product.100707206.html)

 Item  1902379

I ordered and received a set a few weeks ago and have enjoyed seeing them in my yard. They're fairly large. The colors vary some between the leaves: in the promo pic on the website (pic 1) you can see that some are predominantly orange while others have more purple or blue. Most of mine are the purple/blue variety (pic 2), though the colors change a little bit based on how light hits them. 

At some point I plan on applying a clear coat of paint to help make them last longer. 

[promotional pic from costco.com](https://preview.redd.it/0hjwsd4emwv61.jpg?width=680&amp;format=pjpg&amp;auto=webp&amp;s=3495176d2a7655060c1b660d0f86e8b9e850e69e)

[my 5-pack in indirect light](https://preview.redd.it/1m0n04rsrwv61.jpg?width=2857&amp;format=pjpg&amp;auto=webp&amp;s=f1275dd986b4e32d56b22d1ac9e51e02790a3d11)",1.0,1,4
Costco,1619613511,n0dv96,Refund Policy,"I bought these keto chocolate from Costco. It comes in two flavors that are packed separate. Dark chocolate and peanut butter. I ate the peanut butter package, I open the dark chocolate one, and they taste horrible. Very strong bitter taste. 
Is there a scenario I could return for half price or I am SOL?",1.0,1,9
Costco,1619612391,n0djli,"Earlier in the pandemic, Costco allowed relatives to use members’ cards to shop on their behalf. Does anyone know if this rule is still in effect or if it has since reverted back?",,1.0,1,13
Costco,1619590688,n08hcz,What happens if a shop card doesn’t have enough money on it,[removed],1.0,1,4
Costco,1619584215,n06wmg,Product link leads to error page,It's pretty unexpected and I'm not sure if the product (kirkland brand) is discontinued. Is it a normal thing for costco to lead their product link to a 404 when they're OOS?,1.0,1,4
Costco,1619578357,n0599l,Are Melona bars back at Costco? i live in Virginia,[removed],1.0,1,1
Costco,1619577075,n04vux,French Brioché with Strawberry filling,Anyone know when those are going to be back? I really loved them and I can’t find them anymore :(.,1.0,1,0
Costco,1619575398,n04dl6,Almond poppyseed muffins,[removed],1.0,1,1
Costco,1619572514,n03irw,The Dill Pickle Salad sounds good,"After reading about it here I was more than curious to try it out.  So today I went to Costco and could not find it as it turns out I did not read carefully enough here to see that it was in Canada and is not available in the USA.    I found the recipe and it is the same brand as the picture that is here so I will build a batch myself.  Curiosity killed the cat

[https://www.maritimeglutton.com/taylor-farms-dill-pickle-salad/](https://www.maritimeglutton.com/taylor-farms-dill-pickle-salad/)",1.0,1,9
Costco,1619565334,n01btm,OVE Decors Lakeview Vanities,[removed],1.0,1,15
Costco,1619563492,n00pve,How are the Pacific Bold K-Cups?,[removed],1.0,1,15
Costco,1619563153,n00lx0,Double Fudge Brownies?,[removed],1.0,1,1
Costco,1619561510,n001ze,Question for Costco gas fans,"Considering getting a membership primarily for gas. Based on my math, this will be worth it. But, is there a way to tell whether a given Costco sells 91 or 93 as their premium fuel? I know the one near me sells 93 because I called them up, but calling when I'm out on a road trip, for instance, is not feasible.",1.0,1,8
Costco,1619559308,mzz9e2,What's it like to work at Costco?,[removed],1.0,1,2
Costco,1619557473,mzylh2,2 Questions for Owners of the Thomasville Sectional Couch.,"1. Does the storage lid on your ottoman open very easily when just moving the ottoman? Ours keeps opening frequently when we move it. 

2. There are wooden pieces on the front of the bottom (under the entire section near the floor) of the sections. Are those supposed to be removed? My wife keeps kicking her foot into those pieces and she wants to remove them but thinks they are there for a reason. 

Other than that, it's a great couch so far. I just hope the cushions maintain their shape over time.",1.0,1,5
Costco,1619554414,mzxgy2,"What happened to Kirklands hard seltzer,? The whit claw knock off.","I cant find it at all, ever. We use to get it consistently in the winter. With summer coming up, now it's gone ?",1.0,2,5
Costco,1619553824,mzx95a,"Okay, you have 4 hours to plan a date night shopping only at Costco. Tell us about your date night",[removed],1.0,1,1
Costco,1619547476,mzuwk8,Friendly reminder that Costco’s Tire Warranty was changed 6 months ago,"Hello,  just a friendly reminder to anyone who comes here for advice before they buy tires from Costco. 



Our warranty changed in September 2020 where you have credit based on the price of the tire minus any discounts applied (I.e the 150 coupon / 4 )

What this means, is that the minimum cost to replace a tire under the road hazard will be 50 dollars, regardless of what size/make if it was purchased with a coupon. We had a member 3 days ago come in with 3000 miles on a tire and it cost them 60 dollars to replace it UNDER WARRANTY.  

I used to fully back my company and our warranty but since September they have cemented us as worse than most of our competitors",1.0,1,90
Costco,1619546277,mzufz6,Tortellini Salad deluxe,Spotted the Costco take on this!,1.0,1,0
Costco,1619545933,mzub7r,Cart Crew,[removed],1.0,1,38
Costco,1619544879,mztwgn,Costco freight,"Ordered a home gym on April 4. 
Shipping said about 1-2 weeks. After 2 weeks the shipping company calls and we schedule a delivery date, everything is going good so far. After 3 weeks I start to get worried and I call the shipping company who then tells me they didn’t have a truck big enough yet. How does one not have a truck big enough? no idea. I then check the tracking and it says delivered. I tried calling the shipping company and they said an 8 min wait but ended up being over an hour on hold and I gave up. I’m wondering if it’ll eventually show up or someone at the shipping company took it home and is using now lol.",1.0,1,4
Costco,1619540322,mzs4se,Anyone know if Solo Stove is coming back to Costco?,[removed],1.0,1,2
Costco,1619537024,mzqwcf,Third Interview Advice,"Hello everyone!

I have my third interview tomorrow with the GM and I was wondering if anyone here had any tips or advice. I'm pretty nervous about it and I want to do well.",1.0,1,18
Costco,1619535378,mzqaj0,Costco needs to update their Food Court Order System,"Yesterday I waited 45 minutes for a large cheese pizza. 45 minutes of standing there, watching people bulrush the employees working and demanding their food and then getting their food.

I have much sympathy towards service industry workers so not once did I do that until the 30 minute mark when I politely asked when is my order available. The employee said “soon”.

I hate to think this but I really don’t think there is much order in priority for food orders. I witnessed and heard the order numbers far after mine be given full pies. I was so mentally exhausted after the whole ordeal that I have vowed to myself never order a full pie again until Costco applies transparency on who’s in the queue and estimated wait time. For a corporation that prides themself on customer service, I really don’t think I’m asking for a lot here.

Anyone else have similar negative experiences with this? Any tips on how to solve?",1.0,1,62
Costco,1619534282,mzpw69,Costco New Warehouse Jobs,[removed],1.0,1,1
Costco,1619534044,mzpt3j,Ordering to a store,Our Costco in eastern iowa doesn’t offer the Kirkland 23 year scotch. Does anyone know if I can ask Costco or order in a few bottles? Thanks!,1.0,1,5
Costco,1619533186,mzphvp,Tips on Costco Credit Card Warranty for Laptop,"Hi. I bought a Surface Pro bundle from Costco with the Costco credit card Feb 2020.  I'm not sure if it's the crappy Windows updates or bad hardware, but over the past 10 to 12 months, my battery will barely hold a charge. Maybe an hour or so. I don't have anything other than the stock apps running. I just use it for work and browsing the web.

I'm outside of the 2 yrs mfr coverage. Is this something that the credit card coverage of +2 years can address? Any tips on how to go about it?

Thanks.",1.0,1,6
Costco,1619527480,mznmpv,Costco needs to reject cancel culture,[removed],1.0,1,0
Costco,1619519352,mzlff7,Job hiring,if its almost been two weeks since doing my background check should i be worried ? I already gave my two weeks at my other job and im just a little confused😸,1.0,1,8
Costco,1619517302,mzkxfg,Quitting after FMLA,"I’m currently on FMLA after giving birth to my baby, and I would like to quit and be a stay at home mom. I was recently made aware that if I don’t return for a specified amount of time after my leave is up I might have to pay back my insurance premiums accrued during my leave. Does anyone know how long I would have to be back at work before putting in my 2 week notice so I’m not on the hook for those premiums? Also, if I had no choice and had to quit before returning, does anyone know how expensive the insurance contributions are (I’m assuming it wouldn’t be my typical $75/per paycheck I’d be paying back, but a much higher amount that Costco pays for my premiums).",1.0,1,7
Costco,1619492982,mzf5r1,Which SoCal Costcos (SGV/LA/Orange Cty area) have the best variety of Asian products?,"Hi everyone! I've seen posts here and there where people highlight some Asian products they've seen locally, things like custard taiyaki, tropical fruits, and so on. I would love to know which stores in SoCal have them. I just moved down from the Bay Area which surprisingly I can't find many of the items in the SF locations. Thank you in advance!",1.0,1,28
Costco,1619488920,mzdyn0,Costco Car Wash - Underbody Cleaning?,"To those who have a car wash center at their Costco, do you know if it actually provides a decent underbody flush and rust inhibitor, as advertised? I'm contemplating about getting a membership just to be able to clean the underbody of my car during the winters to prevent rusting. I'm unable to find much details online and none of the videos clearly show the underbodies being cleaned. Thanks in advance.",1.0,1,9
Costco,1619485272,mzcun7,Costco furniture shipping - tracking starts with “CH”,[removed],1.0,1,4
Costco,1619484614,mzcn08,"What do international Costco locations sell? Do international Costco locations import foods from the US, or mainly use local products, or both?","From a grocery standpoint: I'm familiar with the Costco products in the NY Metro region, which are mainly all American name brands (manufactured/distributed from America) unless otherwise specified. But what about the international Costco locations such as in Europe (Iceland, Spain, France) and Asia (China, South Korea, Japan): what do international Costco locations sell (food wise)? Are typical American Costco products imported into the international stores (including Kirkland brand products)? Or does Costco supply bulk of local brands native to the country? Is produce and meat from the local region or is that imported too?

&amp;#x200B;

I know with some American chains, when they go into other countries they sell the local products as to cater to the region. So I'm curious if Costco does the same, to what extent and what types of products.

&amp;#x200B;

Any general knowledge is greatly appreciated. If anyone has a link, article, video, etc. as backup that would be especially helpful. Thanks!",1.0,1,14
Costco,1619483028,mzc57u,Do you earn cash back when using the Costco Citibank card at Costco gas stations?,I Hal ave not see a cash back details for those transactions in my account since I got the card 2 months ago. I have a discover card and I love how you can see the cash back you’ve earned for every transaction. Either I’m not looking in the right place or Citibank makes it challenging to track your rewards. Thoughts?,1.0,1,3
Costco,1619482535,mzbzht,Scammed By Costco?,Hello I wanted to make a post on here to see if anyone has had any issue similar to mine. To start I ordered a Xbox Series S off their site. Paid for express shipping and for a membership etc. My issues started when I knew I was not gonna be home that day and wanted to request a hold on my package through UPS My Choice. I checked checked tracking information they gave me at 5pm EST and it was not working. The package came tomorrow and was left at the front door. Okay so far so good I suppose. I come home and go up to my apartment and I see no package. I start to worry but I contact costco. This is where my 20 days of hell started and is still ongoing. I Chat with a lady and explain the situation. During the chat I asked if she needed anything from me. Such as a police report more information things like that. The lady tells me no and to wait 3-7 business days. 8 business days go by I get no email or call. So I decide to call them and they told me to get a police report. I get a police report that same day the 15th. The item arrived the 6th of this month (April) to give you all a time frame. I call them back and send this information to the costco investigations team. I was told to wait 1-2 business days for a email. I wait a little longer no reply I email that team for a more accurate time frame. I get an email back saying I was denied with no explanation as to why I was denied. At this time I have a detective looking into my report and checking the cameras. No one from UPS came at the times they said they did. Meaning they never delivered my package. Despite trying to relay that information to costco. They did not wanna help me anyway. I went to a UPS customer center for more information. Turns out that costco did not declare this item to have any value nor did they put any insurance on it. Meaning that I can't get any help from UPS. I don't know what to do and I hate that they are holding me responsible despite going through every channel I could possible go through. I am not able to add photos to this text but if you need photos and screenshots I can provide those,1.0,1,20
Costco,1619481284,mzbkug,Which COVID-19 vaccine(s) is Costco offering?,"Pfizer, Moderna, or J&amp;J?",1.0,1,1
Costco,1619480995,mzbhjb,COVID-19 vaccines,"Does anyone know which COVID-19 vaccine(s) Costco is offering?  (Pfizer, Modena, or J&amp;J).  I’m in GA.",1.0,1,0
Costco,1619480700,mzbe4j,Best Costco cookware set?,[removed],1.0,1,7
Costco,1619474148,mz94s5,How to determine an estimate for damage claim?,"Like many users on this sub, I had a horrible experience with Costco's third party appliance delivery carriers. Recently I got a refrigerator delivered and the carriers ended up chipping off some wood on our handrail and created scratches on our hardwood floors and front porch.  

Since the arrival of the carrier team, it was already a stressful situation as they 2 men bickered on whether this was a 2 man job or 4 man job. My home has a pretty steep narrow staircase and it felt like the team was not prepared for that. The 2 decided to put this wet rug/mat on the stairs to prevent scratching (pretty ironic as they still lended up scratching the floors) and I legit couldn't watch them carry down our old fridge because it looked so dangerous. They ended up needing more help and my brother and dad had to step in to help them carry our new fridge up. 

They are asking for an estimate of the damages, but I'm not sure how to gauge what number to give them. Do I just give them a number or doI have to break down the damages? For those who have gone through with damage claims, how did you determine the estimates and what ended up happening? Any advice on damage claim estimates would be helpful.",1.0,1,4
Costco,1619472634,mz8kn1,Anyone buy the Yale SL assure Deadbolt lock?,Looking to upgrade my standard deadbolt lock and saw this one at costco. I just want something more convenient. Going on long walks/runs with key or locking key in outside lockbox w/combo is becoming a minor pain. Any feedback would be greatly appreciated.,1.0,1,12
Costco,1619466579,mz69sp,Any updates on the combo pizza?,Does anyone have any insight for the delicious combo pizza? Is it still the case that it is permanently discontinued? Any rumblings of possibly bringing it back??,1.0,1,3
Costco,1619466083,mz62zw,Could I use someone’s Costco membership?,[removed],1.0,1,1
Costco,1619454664,mz1p58,Executive rewards balance,I used to be able to see my balance under my account on the Costco website and app. It seems to have been missing for quite some time now. I've looked everywhere and just can't seem to find it. Am I overlooking it somewhere or do they just not tell us anymore?,1.0,1,4
Costco,1619453746,mz1cm4,Hackensack NJ Business Center reopened today with limited hours,"Just got off the phone with them. They have reopened, but they're now only open 7am to 3pm Mon-Sat.",1.0,1,10
Costco,1619443257,myximv,Help me decipher what's included in the installation of my washer and dryer,"Hi everyone,

I just ordered the Samsung Flexwash washer and dryer. Help me understand if the gas hookup of the dryer is included as I am confused by what seems like conflicting info:  in the detailed receipt, I see a ""red X"" on ""hookup of gas appliance"" but ""checkmark"" on ""2nd appt required to install gas appliance."" Does that mean they hook it up but it might take a second appt? 

Thanks, everyone.",1.0,1,14
Costco,1619430880,myu3qe,So... these were gone quick as well...,"&amp;#x200B;

[I swear it was in stock not an hour ago \*sigh](https://preview.redd.it/2cuvioytphv61.png?width=794&amp;format=png&amp;auto=webp&amp;s=3b8b19d01546caa33a010c00fe02acf4ebbec7a1)",1.0,1,0
