subreddit,created_utc,id,title,selftext,upvote_ratio,score,num_comments
Costco,1622299967,nnp2tp,Holiday schedule question,"I work at a depot in the e-commerce department. We operate Sunday through Friday. Everyone gets Saturdays off (except during the holidays), and we all have one other day off during the week. I plan my life around my weekday off. So do my coworkers. 

Memorial Day means we are closed Monday and we all get holiday pay. The schedule for Memorial Day week was posted, and I had my regular weekday off in addition to the holiday and Saturday—so three days off this week for the holiday. 

But on the original schedule, those employees who usually had Monday or Tuesday off lost their third day off for the week. They only had Monday and Saturday. This upset them, so a few complained to the manager. She told them they were causing trouble for the business. Then, this Wednesday, she redid the schedule for next week and took away the weekday off for every single part time employee. So now, we are all off on Monday (holiday pay) but working Tuesday through Friday.  

Does this violate some Costco rule? What should we do? Or is it totally fair and legit for her to do this? Thank you.",1.0,1,1
Costco,1622299726,nnozwa,Costco Shop Card from Costco Travel Booking?,"I booked my honeymoon to Cancun through Costco Travel (also used the Costco CC for this) and we went 4/3 - 4/10. Included with the booking was supposed to be a $212 costco ship card. I haven't heard anything and it has been almost be months since we left. When should I be expecting to get this Costco Shop Card and where should I expect to get it? 

Thanks!!",1.0,1,6
Costco,1622295088,nnnjnv,Natural casing hot dogs,Does your Costco sell natural casing hot dogs? Last time I was in Costco (las Vegas) I asked if they could order me some because I’m tired of ordering them on the internet at crazy shipping prices. I was told if there were other Costco’s that sold them they can probably order some. Does that even sound right? Love hot dogs but can’t bring myself to eat a non natural casing dog. There’s no pop! Gotta have the pop.,1.0,1,11
Costco,1622293482,nnn312,Cascade Complete dishwasher pods: anybody else notice that they don't dissolve as well as they used to?,"My pods now often remind half dissolved and leave a gooey lump behind.

[View Poll](https://www.reddit.com/poll/nnn312)",1.0,1,12
Costco,1622280771,nnjuei,Food court. Will the turkey sandwich and or the ceaser salad return?,I miss the turkey sandwich and the ceaser salad. Will they return to the food court.?,1.0,1,7
Costco,1622267808,nngu80,Costco Logistics/Innovel Solutions,"Ordering any large appliances from Costco is a mistake. I ordered a washer and dryer on 5/4 and had to wait two weeks until my appliances would be received by the Costco/Innovel facility. I was notified that my shipment was ready to be delivered on 5/21. I took time off of work to receive my items between 8AM-10AM. The delivery never occurred and I called Costco back. Their response was, ""one of your two items was not received. We can't deliver your items"" Then why would Costco/Innovel email and call me twice that my items would be delivered. I call back the following day to reschedule the delivery for the following week on 5/28.

On the second attempt for the delivery on 5/28, I was again emailed and called that my items would be delivered, this time between 10AM-12PM. Guess what, that was a lie, the items never arrived. I called Costco/Innovel customer service and I was told to call them back after a 1.5 hour grace period occurred, a leeway window for ""late"" deliveries. I waited and no appliances. I called back again and was transferred this time directly to Innovel's direct customer line. I waited an hour, no luck getting help. I hung up and called Costco/Innovel back to report the poor experience and missing two days of work for phantom deliveries. Now I'm told I have to wait until 9PM for the hopes the appliances arrive. Spoiler, it’s 10:54PM and they did not arrive…

At this point I'm canceling my order first thing and demanding a refund. I warn you now, ordering any large appliances from Costco to be delivered is a huge waste of time and money. You're only guaranteed to get frustration. The negative reviews online for Costco Logistics/Innovel go back to January 2021, maybe ever earlier.",1.0,1,19
Costco,1622262114,nnfdpe,Some Costcos Have Regal Movie Tickets 2 For $5.97,"There were some posts awhile back about Costco putting movie ticket vouchers on clearance. With theaters reopening, I was surprised to find at least one Costco still selling movie tickets at the clearance price. Costco item #3845008 is two Regal Cinemas movie tickets and as of a couple days ago is still $5.97. They were in stock, but limit 10 sets (20 tickets) per member/transaction at Costco #1342 in Fairbanks, Alaska (the world's northernmost Costco). Cashiers were encouraging people to buy the limit as the price could go up any day and less than $2.99 per ticket is a great deal. I'm not sure if other locations still have them in stock or if employees currently have sales targets for them, but it's a great deal if you can find them at that price.",1.0,1,7
Costco,1622260178,nneug0,Purchase History Retention,Does Costco retain my purchase history if I close my account and reopen a new account after a couple years?,1.0,1,2
Costco,1622252613,nncs2b,"USA, which is worse? Tmrw or Sunday?","I am overdue for a Costco run and was planning to go this weekend. Considering Memorial Day is Monday, it's going to be a hectic weekend. Is there one day that's better than the other or am I just gonna be in a school of fish no matter what?",1.0,1,25
Costco,1622248512,nnbn5x,Do you have Jones pork sausage patty or link in your store?,"Which one do you have, link or patty?  We only have chicken links, these are great, but We also like pork patty for variety, but I wonder if these are even offered in other Costco stores.",1.0,1,5
Costco,1622247509,nnbd7o,Just resigned from Costco. Got an extra check on payday. Basically for the full amount of a normal check. Any idea what it could be?,"I’m not eligible for the extra check, and I was with the company for almost 4 years. Had no personal or vacation time in the bank. Really struggling to find out what it could be?",1.0,1,19
Costco,1622245408,nnarts,Does Costco usually deliver ship their pillows without any retail packaging?,"Question for anyone who has ordered a pillow from Costco online.

First time buying pillow from Costco online since I didn't see the one I want in the warehouse. I just opened my package containing my Serenity pillow. I was surprised to see that inside, the pillow was just wrapped by a single layer of plastic bag and nothing else. And the box it came in is just a regular non-descript box.

I was expecting to see all of its retail packaging like you would if you bought it from a warehouse. Is this normal for this kind of product?",1.0,1,9
Costco,1622242816,nn9zo9,Costco glasses.,"Typically when does, if they even do it, do they have a buy a prescrption glasses get prescription sunglasses free/ or even discounted? Or is the 40 off the second pair, like they have now the best they do?",1.0,1,9
Costco,1622240826,nn9d35,"It took Costco 3 times to deliver a 77'' TV to me, and it arrives broken :(","Horrible service with their Innovel Solutions shipping company. Failed to deliver twice, the first time they arrived too early. The second time they completely failed to pick it up at the warehouse. The third time, the TV arrived with a big crack on the screen, which wouldn't even turn on.

Absolutely a nightmare experience. Now I have to wait another week or so before I can another TV delivery attempt.",1.0,1,16
Costco,1622240591,nn9a9x,Opticians of Costco! Questions about hiring process,"Hello! I am currently an apprenticed dispensing optician in a licensed state with about two years of experience on my resume. There is a Costco warehouse opening in my region in about a month and a half; having heard only good things about their optical department, I applied for a full time non licensed position yesterday. I have read that most full time positions are given to transfers and that it is difficult to be hired full time if you are not currently employed there. However, since the nearest Costco is a minimum of 2 hours away (possibly less transfers?) and I would be coming in pre-trained, I was feeling pretty hopeful when I applied.

I am curious to know when to expect a response from them- will they contact me even if they’re rejecting my application? I also asked that they not contact my current employer because I haven’t told my employer I’m applying for a new job- will that hurt me since I asked them not to contact the only place where I have optical experience?

Also, one last question that isn’t so urgent: do you get training with ordering and dispensing contacts? My current job does not order contacts because we don’t do exams or fittings, and it would be a nice bonus to be able to learn all of that before getting licensed.",1.0,1,7
Costco,1622237202,nn83zt,"Your next Costco run could be more expensive as the company warns of expected price hikes for key goods, including trash bags, cheese, plastic plates, and beef",[removed],1.0,1,2
Costco,1622234869,nn7928,Employee situation need advice.,I am a 58 year old man in the past 7 years at Costco I worked the chicken room. In the past 2 years since I have been full time I have missed 5 months for surgery’s. My boss will not move me from the chicken room which is killing my body. Does Costco policy enforce that I can switch to a front end or different department if I am not able to do my job? My boss has written me up twice in the past year on minor offenses and made it clear he does not like me. I’m concerned for my job. Any advice or heard of similar situations? Thanks for the help!,1.0,1,22
Costco,1622234240,nn70ms,Costco employees question.....,"Hi all. I decided to post for reasons, I’ll try and keep this short and I can’t seem to find my handbook ): 
I work as a pt clerk in the state of California for Costco location I’d rather not say for just under 10 years. Without going into personal details about my life I’m considering taking a leave of absence(LOA) for 1-2 months because my personal life is now effecting my job at Costco and my dr is recommending I take time away from Costco. However about 2 weeks ago I took a summer job where I would be working no more then 20 hours a week and will end in August. I originally took this temp job making minimum wage in hopes to better my mental health. I took this job before I committed to this job before I realized how much I was struggling with my mental health. Anyway so I called my location payroll/HR to find out if this would be an issue which I figured it would be but I’m also trying to be as transparent as I can be about the situation cause I’m not trying to “pull a fast one” IF I decide to go on a LOA from Costco is there anyway they would find out I took a temp job? Nothing is worth losing my main source of income(Costco) including my mental health, I would hate to quit the temp job because it is mentally rewarding but if I have to in order to not jeopardize my position at Costco I will. Any info would help I apologize if this is uncomfortable to answer as I stated I spoke to my payroll/HR but I also learned long ago that payroll/HR is there to protect the company always, not you. 

Thank you to all with any helpful advice.",1.0,1,2
Costco,1622233798,nn6uya,Costco user experience is terrible?,"&lt;just some rant&gt;

Strange if this is just I am so unlucky for last couple years or I didn’t notice this before. Just bought a TV online and used a wrong credit card (not a Costco one that give extra 2 years warranty). I noticed that when was in Costco and decided that customer service can help me. No way, they said to call number from Costco.com. Over the phone they also could not chance the card. They can only cancel but this goes with a fee… (for order that I made less than hour ago :( ). 

Continue on “experience”: their app never stays logged in. It logs out every time. Cart in app drops items randomly. Costco doesn’t care care about  online experience at all? Stuck in previous century?

For the unknown to me reason I decided that buying from Costco will be better than Amazon (same price) , I was sooooo wrong (never had terrible experience with Amazon, multiple times with Costco now)",1.0,1,6
Costco,1622233518,nn6reg,Change to $4.99 Rotisserie Chicken Price Possible,[removed],1.0,1,17
Costco,1622232757,nn6hl7,Woozoo fan,Anyone have one how are they? I can’t remember if they were on sale or not?,1.0,1,13
Costco,1622226358,nn4814,Have they added back all of the varieties of pizza to the food court?,So in my area (southern USA) they took away all of the pizza flavors except for cheese and pepperoni due to the pandemic. Have they added back their full pizza menu now? Sorry if this sounds stupid to ask on here. I have not personally been to the store in over a year and the person who goes for me (my husband) has not taken notice of their menu lol. Thanks in advance!,1.0,1,8
Costco,1622225818,nn412r,sale again for KitchenAid 6 series?,"So I am looking to gift a KitchenAid this Memorial day weekend and seems like the price is back up to 350$ @ WA. I am almost certain I saw it for 250$ at some point in time and seems like others have as well (based on older posts). 

Any suggestions on waiting for this ""100$ sale"" which happens at certain times, or buy and request a ""Price Adjustment"", if it kicks in? (note: price adjustment happens within 30 days according to their site). 

A +100$ is sort of a deal-breaker to my head and I ""could"" buy another gift  :shrug: 

Any other thoughts are welcome as well :)",1.0,1,4
Costco,1622225547,nn3xjv,Costco Food Sampling Coming Back!!! CNN Article,[removed],1.0,1,2
Costco,1622225145,nn3s5p,Can I use Costco gift cards for phone kiosk purchases?,What are the upsides of using the third party kiosk? Downsides? Are you happy with your purchase with them? Can I use Costco gift cards?,1.0,1,2
Costco,1622223580,nn374c,Anybody find the Cru Chablis at their local Costco?,Haven't been able to find it anywhere in the Chicago area.....,1.0,1,0
Costco,1622221403,nn2e37,"I hate this job, just want to transfer but can’t. Help.","I’ve worked at costco for two years. I hate every waking second of it. The complete lack of training, braindead management, rampant nepotism, sexual harassment, revolving door of employees, and fickle safety procedures are just a few of my concerns. Our warehouse manager asking Covid-positive employees who didnt show symptoms to still work their shifts is yet another concern.
Being screwed out of my Covid bonus as a part timer who works full time hours is, again, yet another concern.

When I started, I really gave it my all, but it slowly faded, starting with when they promoted a man in the warehouse who was well known to sexually harass every female coworker in the store, all because he was cozy with management, not because he was even remotely close to fulfilling his job description.

The only reason I’ve stayed at all is to transfer out of state then immediately look for something else after moving. I’ve been sending out transfer requests and job bank applications left and right since the start of this year, and can’t seem to secure anything or get any opportunity to leave my warehouse. I’ve put in for almost 40 jobs, interviewed for about half of those applications. Nothing.

Look, I’m remaining cautiously hopeful that this is just my current store, not the company as a whole. I would love to transfer to see if an older more established warehouse has it’s shit at least somewhat together. But what now? I’m in great standing, near perfect attendance, perfect reviews, and even letters of recommendation, but I get nothing but transfer denials, rejection letters, or just complete radio silence on any job transfer I apply to.

Is it even worth trying to transfer with this company? Because my mental health means much more to me than Jelinek’s stock going up a quarter of a percent.

*cue the cult members lecturing me en masse about how capitalism works*",1.0,1,36
Costco,1622218040,nn162i,Costco Travel,"I just booked a cruise for January through Costco travel. It was about $200 less than attempting to book by myself/with a travel agent. We also got a free soda package, $50 on board credit and $95 Costco gift card we wouldn’t have gotten otherwise.

I mostly use my membership for groceries, but I am so glad I clicked into the travel page.",1.0,1,5
Costco,1622217514,nn0yqn,Today I walked into Costco and only bought one thing.,"I bought a half cheese/half pepperoni pizza from the food court. I didn’t browse at all. I was laser-focused on the mission at hand. $10.55 was the total damage, and I put that on my Costco Citi card for 3% cash back rewards. I had my orders (“go pick up the pizza”) and I completed the mission with honors. This may never happen again, and I had to document this achievement. I ONLY BOUGHT ONE THING AT COSTCO!",1.0,1,67
Costco,1622217190,nn0ujz,Lemon 4th of July ice pops,,1.0,1,2
Costco,1622216724,nn0onb,So how much does Costco pay its employees in WA?,Is this a decent place to work?,1.0,1,10
Costco,1622214784,nmzzml,Friendly reminder,[deleted],1.0,1,0
Costco,1622207391,nmxhxr,"Whole snapper, 4 pack","My local Costco in Duluth, GA sometimes carries whole snappers in 4 packs. These are wonderfully fresh and perfect for steaming, but sometimes they don't have them. Does anyone know if there's a certain schedule for when they stock these, or was it a seasonal thing, or other?",1.0,1,1
Costco,1622207263,nmxgia,Black bean recall expanded,"I was aware of the first recall but not aware it had been expanded until I got a letter from Costco. Posting in case others may not be aware.

https://www.eatthis.com/news-costco-beans-recall-extended/

https://www.fda.gov/safety/recalls-market-withdrawals-safety-alerts/faribault-foods-inc-announces-extension-voluntary-recall-limited-quantity-sw-brand-organic-black?permalink=064FBE227A51C66966D5603C928276BCAA2933F653CA9E0ED045D1A505B36782",1.0,1,2
Costco,1622206359,nmx6db,Personal Time,"Does Costco pay out unused personal time after your two weeks notice? or should i call off during my two weeks to benefit from all the time i earned. i live in CA and have been here under a year, so no vacation time yet just personal",1.0,1,10
Costco,1622178113,nmq942,The Costco Tour,We're going on a short road trip from Reno to Boise to go to a favorite restaurant that went out of business locally but is still in Boise. But what got us really excited is finding THREE Costcos in the area that we can check out. 😄,1.0,1,14
Costco,1622171819,nmoiit,Whole brisket,"Looking for a brisket to smoke for Memorial Day, my usual store usually has them but I didn’t see them tonight. Anyone know if the business centers carry them all the time?",1.0,1,4
Costco,1622167020,nmn64b,"Scotch, anyone?","As spotted in Costco, Washington DC... ;-)

https://preview.redd.it/odwcjj3tpr171.png?width=2880&amp;format=png&amp;auto=webp&amp;s=bfd243b9710a0061b7f978462a683f01012cb880",1.0,1,33
Costco,1622166494,nmn0ud,Hot Dog Wrappers,Anyone know why Costco did away with the foil hot dog wrappers and are now putting hot dogs in the paper bags?,1.0,1,10
Costco,1622153112,nmiwpf,What's the best Costco between Washington DC and NYC,"In short, for Memorial Day we drove down to DC and want to stop at a Costco on the way up.

We're always amazed at how different Costco's are. Of course many have the same Kirkland products but when I visit other stores, amazed at the differences. Our regular stores is small compared to others and the only Costco that can sell Kirkland alcohol is in Long Island.

If someone can recommend a store to stop in on our way back up. Highway we used coming here is I-95.",1.0,1,34
Costco,1622151374,nmia5a,Does Costco no longer offer just car rental?,We have been able to book just car rental in the past through Costco.com. Now it only allows you to do this if you book a hotel/car rental package. Does anyone know when this changed (it was over a year ago when I last did this) and when just car rental might return? I’m guessing it is due to the rental shortage so they want to give their package buyers priority but thought I would ask if anyone here knew.,1.0,1,8
Costco,1622150014,nmhss9,Frustrating experiences with Costco and Innovel,"As of this post, I've spent over 6 hours on hold, and have waited multiple days, only to be jerked around- told one thing, and then another happens.  

My washer dryer delivery was scheduled for may 4, and did not arrive until May 24, I kept being told it would be delivered earlier, and then when no one showed up, I was forced to call, and they kept pushing the date back.  This happened 3 times.  

And recently I tried to return a mattress, waited on hold for over 6 hours, it's been over 2 weeks of me trying to get this thing returned.  Finally today they said they would schedule it for June 3, but I am not very hopeful.  The guy on the one was pretty curt and rude, had 0 empathy that I had to go through such a frustrating process.  
  
Just wondering what the issue is.  I know Covid has caused a lot of issues, but I don't think it's an excuse for this terrible of customer service.  I understand delays, but just let me know beforehand, don't make me call in and spend hours on the line just trying to figure out what is going on.",1.0,1,2
Costco,1622146695,nmgkae,Has anyone tried the s’mores shortbread cookies?,,1.0,1,3
Costco,1622145019,nmfx7m,Shark Performance Life-Away or Bissell Crosswave Premier Vacuum?,"The Shark is on sale for 199.99 and the Bissell is currently 239.99. I'm having a hard time deciding and the review sites I found didn't have a clear winner. I have pets, hardwood floors and rugs.   


Does anyone have a firm opinion on either one??",1.0,1,7
Costco,1622141379,nmeixd,What happens to all the food about to expire?,[removed],1.0,1,18
Costco,1622140749,nmeacp,Costco's large appliances delivery company - Innovel Solutions is so horrible!,"Purchased a TV from Costco on Friday, to be delivered on Wednesday. No tracking updates whatsoever until the night before. In the email, they said the delivery window supposed to be between 12:45 PM &amp; 2:45 PM but they arrived 2 hours early &amp; then left! I have to call Costco to reschedule the delivery for the next day.

On the next day, no updates whatsoever, I have to call Costco again! Somehow it's not on their schedule for delivery today. Even though the lady confirmed that yesterday.

How can a company be so incompetent is beyond me. Costco needs to get these guys act to straighten up (Apparently Costco owns them).",1.0,1,17
Costco,1622139031,nmdmt6,"I wanted to get a job at the bakery department. How do I go about it, am I supposed to call the department and ask if they are hiring? And what are other good questions to ask?",[removed],1.0,1,8
Costco,1622134791,nmc053,COMING SOON - Costco Auto Program,Additional savings are coming! Costco members can receive limited-time savings on the latest models from popular brands. Visit [https://www.costcoauto.com/special\_offers/default.aspx](https://www.costcoauto.com/special_offers/default.aspx) on June 1st for more details.,1.0,1,5
Costco,1622131621,nmatij,COSTCO GAS PUMP DEFAULTS TO PREMIUM,"Costco Gas pump defaults to premium in certain situations. 

Costco Gas is the lowest priced in San Diego.  Always busy,  but well maintained.   There are two octane selections on the pumps.  The first time a pump I was using defaulted to premium,  I mentioned it, as an FYI  to an attendant.  She took my info.  I received a call saying I pushed the premium button.  I accepted this as a possibility and have been mindful of which fuel octane button I push.

Forward, a year later, a different Costco.  I push the lower octane button and notice the higher octane, higher price button, which I did not push lit up.  I pumped fuel and took a receipt.   The receipt confirmed the premium fuel charge.    
A $3 price difference for fuel purchased. This time I noticed a fuel truck filling an underground tank while I was pumping.   This may be a coincidence. 

I put this out there wondering if anyone has had a similar experience.",1.0,1,14
Costco,1622129795,nma58z,Costco Online cold and frozen delivery,[removed],1.0,1,11
Costco,1622129437,nma0qe,Experience with ReadyRefresh?,"Hi al!

I was planning on subscribing to ReadyRefresh water gallon delivery in NYC but wanted to hear some opinions first. Do you like it? Any issues? 

Thanks!",1.0,1,5
Costco,1622125303,nm8jw6,calling out work,"hi, im a new hire, like three weeks in, and i was just wondering will i get in trouble for calling off? i am sick today and want to stay home, its a 1:30-10pm shift and i don't think  i can make it through. im a bit confused on everything so i just wanted a clear answer",1.0,1,57
