subreddit,created_utc,id,title,selftext,upvote_ratio,score,num_comments
walmart,1622629871,nqiq8k,Any other meat/produce workers getting sent to cap 1?,We're expected to have everything done by lunch then we're sent to help cap 1. Pretty damn annoying doing cap 1 work without the cap 1 pay everyday. 🙄 And no we are not short people on cap 1.,0.99,1,16
walmart,1622627853,nqi7w6,GWP = 🤮,,1.0,1,6
walmart,1622625872,nqhqw5,Does anyone have or remember the old fresh overnight cleaning schedule,,1.0,1,4
walmart,1622625320,nqhm3v,Wismo you ignorant slut.,Anyone else having issues with logging onto Wismo? I keep getting Internal Server Errors.,1.0,1,2
walmart,1622624537,nqhfiv,Is it this night shift or every night shift at Walmart?,Is it this night shift or every night shift at Walmart has a stick up their ass when it comes to new stockers? I've been here a week on night shift and I already hate these people like now I understand why the turn over rate is high,1.0,1,34
walmart,1622623691,nqh8gj,Got an interview for asset protection,"This is completely out of my comfort zone. I have social anxiety, so confronting people isn't entirely something I like doing.

I read up a bit (mostly stories about it on here) and honestly feel I'm out of my element.",1.0,1,7
walmart,1622619722,nqgant,Emoji Hunt Help,[removed],1.0,1,0
walmart,1622619560,nqg97i,Yikes,High five for mental breakdowns in the cash office because you’re not an actual manager and just filling in but you don’t have the options to access anything &amp; management won’t answer calls so you’re getting screamed at by customers all while the cash machine breaks down :),1.0,1,1
walmart,1622618876,nqg3dr,Confused please help,So I applied for replen ta 1 at Walmart supposed to be making $14 and hour after some research and looking at other peoples questions about replen ta 1 I assumed it was the same as a stocker and when asked at orientation what I applied for I said “stocker” but now looking into it deeper they said the average pay of a stocker is $13 and different so did I just screw myself?,1.0,1,3
walmart,1622617642,nqfsvd,Shareholders and new info,Anyone know the days this week when management will have their meetings regarding the new stuff? Just the schedule of shareholders in general.,1.0,1,5
walmart,1622617509,nqfrns,How long do they wait to fire someone after they colossally fuck up?,"Basically last week they caught me doing something that is a terminable offense. They caught me red handed, and I was talked to in the office by the SM and SL. both of which told me they would follow up.

Nothing happened for a week, then yesterday I get pulled again, and they had me write an ethics statement, the one in which they of course got a full confession out of me because like I said I did get caught lol

They asked me a bunch of questions, and at the end told me that they would once again, reach out to me later.

It’s not theft, it’s not anything even really bad, but it is strictly against policy, the kind of shit that opens up a can of worms. Anyways I talked to one of my TLs today and he told me I should start applying now lmfao :( he’s sure they might fire me if not just give me a red coaching but so far they haven’t done anything and it’s been about a week now. Anyone have any insight into what might be going on behind the scenes? It just sucks not knowing.",1.0,1,10
walmart,1622616227,nqfg2i,Do they background check on a gm team lead? I’m just curious if they do that,,1.0,1,7
walmart,1622614717,nqf2vu,Customer called me a dingle berry today.,I'm not even mad...just intrigued. Of all the things to call some one. Anyway.,1.0,1,6
walmart,1622614609,nqf1xe,Today's Story,"Today at work, someone went to the garden center, by the carts, pulled his pants out, and took a SHIT right by the carts. Like what the fuck.",1.0,1,8
walmart,1622612504,nqeixy,Most efficient way to cut plastic off soup/pasta,"Trying to get grocery cases per hour worked to 70 an hour per person. It's going pretty well we are sitting at like 62 when we swam grocery. However most people are complaining about how much the ""new"" knife sucks for cutting plastic off these cases. I know it isn't new anymore, but I still use my handy easy cut. For me I just cut a quick x in the bottom of the case and tear the plastic off, by far in my opinion the fastest way. However I don't have enough experience with the new knife to know the most efficient way. If anyone could give me thoughts.",1.0,1,20
walmart,1622605762,nqcn6g,worst aisles to stock to best?,i feel like soda water juice or pets is the worst especially with these triple truck days back to back easiest is breakfast and infants,1.0,1,39
walmart,1622605560,nqcl1u,Attention Customers,"Bathe.  This is not your home.  You smell like wet garbage and your meth mouth makes me want vomit.

Put some damn clothes on.  You don't go anywhere else outside with your pajamas on, why the hell is Walmart (the place you are most likely to run into someone you know) any different?  If your 'sitting around the house hot pants' are being devoured by your fat ass, random strangers do not want to see it.

Stop picking up shit and dropping it anywhere.  You are the reason the store looks trashy.  No reasonable human being shops like this anywhere else.  And also, when you take something from frozen, and don't put it back in frozen - you might as well have spiked it on the floor like a football.  It's trash now.  You raise the price of everything else in the store when you ruin food you gormless oafs.

The shopping cart corral is right the fuck over there.  Look up. You see it?  That's where carts go.  Are you so fucking lazy that 10 feet of walking is just too much?  Of course you are.

Shoplifting applies to all products you and your child consume.  Popcorn chicken is not a free snack.  I hope they fucking choke on it.

Your rancid screeching offspring are your responsibility.  They don't know better, but that doesn't excuse you from their actions.  I know that you have grown accustomed to ignoring the little hellspawn, but for the last time:

Walmart is not your home.",1.0,1,91
walmart,1622605265,nqchxj,am I gonna be in trouble?,basically I'm a new hire (only worked 5 days now) and was shredding old phoyos in photolab because they were oldwr thwn 60 days or something. I was 5 minutes away from the end of my shift and wasnt paying attention and accidentally put a CD in the paper shredder LMAO and it wouldn't come back out and I just left it and didnt say anything. Will I be in trouble?,1.0,1,5
walmart,1622604871,nqcdoz,I love their popcorn shrimp in the hot food section. That's all I have to say.,,1.0,1,17
walmart,1622604062,nqc4iq,Got a job position for Team Associate,I'm kinda nervous as it'll be my first real job and I still gotta do the drug test and show up by Saturday and I'm so overwhelmed :( any advice for the first day?,1.0,1,10
walmart,1622604056,nqc4fv,Offered a part-time position with a tendency to go full-time,[removed],1.0,1,0
walmart,1622602215,nqbjvz,Wal-Mart Discord?,Is there an official or unofficial Wal-Mart Discord server?,1.0,1,4
walmart,1622600725,nqb3ji,Transfer to Auto.,"Anyone who transferred to auto and became a tech, especially someone from Stocking team, how much better was the move for you?",1.0,1,2
walmart,1622600065,nqaw7z,shorts,"i’m a female lawn and garden employee and we’re getting into 85° F weather where i am. i go outside and water the flowers and i just think i deserve to wear some shorts. the boys wear shorts, my male team lead wears shorts, can i? how long do they have to be? my managers don’t really enforce the dress code and we all wear graphic t shirts and i’ve seen boys wearing ripped jeans. i deserve shorts.",1.0,1,15
walmart,1622599447,nqapdj,Question,"Will Walmart sell the Pokemon TCG Build &amp; Battle kit for the new Chilling Reigns set this week? 

Any information is helpful, thank you.",1.0,1,3
walmart,1622597485,nqa307,"My store has an opening for front end team lead, wanted to hear opinions on the job. Worth the money? (I know each store will be different)",,1.0,1,22
walmart,1622596878,nq9w71,How often do clean the mirrors in apparel and shoes?,"I go by them every day and had forgotten they were there. We had to wipe them all down because the TL spotted greasy handprints all over one of them. 

They all needed it, but we never gave it much thought.",1.0,1,9
walmart,1622595225,nq9czu,My 1st point in 2 years,I feel so bad for just calling out one day to be with my fiancé 😂😭 it’s only 1 point but I’ve had 0 for so long,1.0,1,16
walmart,1622594823,nq98aw,NHM associates. Is anyone in your store making $15 an hour? Asking because I'm doing a transfer from Deli to cap2 and was promised that Cap was making $15 at a 3pm-12am shift. I don't really know if I trust the store manager atp.,Help,0.99,1,14
walmart,1622594177,nq90tr,Points for (non-covid) sick leave?,"I have strep throat rn but have never been normal non covid sick since working here. If I call off tomorrow, will I get a point? I can't afford to take another point 😕",1.0,1,4
walmart,1622589169,nq7dhw,My Walmart wildin😂,"So I’m Mexican and I just started as a stocker, only been working for a few days and my supervisor takes me to the Hispanic isle and tells me “this is your isle, you’ll be taking care of it and making it look neat until we bring you a pallet” so I was like BET. I felt at home yunno. Then my Hispanic co worker brings me a pallet and she proceeds to tell me that also put her in this isle when she started😭 she said “they got all the brown people working there”. Just thought it was funny lol",1.0,1,46
walmart,1622588651,nq7782,Probably a dumb question but...who closes your store?,"I'm a closing APCH, my schedule ends at 11pm when our store closes.  However we still have customers in the store because the manager is so afraid to lose a sale that he will allow people to enter even at 10:59pm.  

I've tried asking different managers and of course I get different answers.  Our front end team lead says we can turn off the door at 10:55pm and we do not have to stay and wait for the last customer to leave.  Another manager says we do have to wait for the last customer to leave, even though our shift ends at 11pm.   Overnight manager says we cannot leave until the front door is secure and locked (however we do not have keys, all we can do is turn the door switch off so it won't automatically open).

For a few months, I was nice and I stayed until the last customer left...then they started cutting my hours because I had over time.  Nobody ever came by to watch the door, turn it off, or lock it.  Since I can't afford to have my hours cut because someone is not doing their job, I started leaving at 11pm.  They've started sendng a cashier to the door but on her days off, there is nobody who comes to watch the door for the last customers.  Last night was one of those nights and I left at the end of my shift.  Now I've been hearing a rumor that I'm getting coached for leaving the door unsecured (today is my day off---if I do get coached I will refuse to sign).

&amp;#x200B;

So.....who's job is it to lock the door when the store closes?  I'm not a team lead or a manager or anything.   I joke that I'm so low on the totem pole that I'm underground.",1.0,1,44
walmart,1622587256,nq6pkp,Come join the Unofficial Walmart Discord!,"Hey folks, there's a Discord server that's been running for the past 3+ years for Walmart associates, I just want to invite anyone interested. 

I'm one of the mods over there, so feel free to reach out with any questions or complaints.

https://discord.gg/GdfZ2tS32F",1.0,1,3
walmart,1622586666,nq6i7f,covid vaccine LOA?,i was under the impression that when you get the covid vaccine you qualify for 3 days off.. is this determined/enforced by the store manager or what? our store manager says we can't get 3 days off without a doctor's note explicitly stating we have side effects due to the vaccine. i'm wondering if that's allowed,1.0,1,8
walmart,1622586390,nq6eph,Part time hours and flexibility?,"I was thinking of applying to Walmart but I was wondering what the hours and flexibility are like. I’m looking for no more than 32 hours a week, though I’d be happier with 25ish. Is that doable there, things like holiday weeks excluded? 

Would it be best to just apply with 2 or 3 days where I’m not available? Would they still even consider hiring me if I wasn’t available 3 days? (I know it can’t be weekend days) I’m only actually not available on Wednesdays as of right now, but I’ll be starting school in August and a dedicated two days for schoolwork (I’d take online classes) plus Wednesdays would be preferred. I figured if I had 3 days where I wasn’t available that would also make it unlikely I’d be scheduled over 32 hours as well. That being said, I’m afraid they won’t want to hire me either if my schedule isn’t as open as possible, and I’m desperate to leave my current job.",1.0,1,7
walmart,1622586285,nq6de7,Question?,"So I had a question since most associates are telling me since I'm a minor and I'm in school I cannot work during summer in the morning because apparently I'm still in school , they told me I can only work from 4 to 8 pm. 
I tried looking for information about this but they didn't say anything about a change. Idk if it's only in my state or no. 
If anybody knows about this can you please say something in the comment section",1.0,1,4
walmart,1622586034,nq6a9f,Do I get a lunch? Truly?,"So some days I work for 5.5 hrs and I have an hour lunch. Other days I work 5.5 hrs, I have no lunch at all. Which is it supposed to be? Someone i know also only has a 30min lunch when working a 3p-10p shift. We are confusion.",1.0,1,4
walmart,1622585741,nq66hk,I haven't even had orientation and I already wanna quit. Also question for cashiers,It's taken me three weeks since my phone interview to even hear back from them I've tried calling multiple times a day and just today got the form i needed lmao. Can't wait to see how long I have to wait to start orientation. Btw what is it like being a cashier? Boring? I'm guessing so.,1.0,1,6
walmart,1622584652,nq5s9q,Opinions Everyone....,"Equipment is hard to come by in my store, as in all stores I think. But tell me if this sort of thing happens elsewhere.

 Now this is what I heard---so I'm treating it like gossip until I confirm it with the person involved. 

 So (hypothetically or allegedly) a salaried member of management went into the system and got the Claims Supervisor's WIN # to over ride the fasnal lockers to pull out TCs and printers recently.  The Claims Supv is the only one with Master Admin options allow access to the lockers because Salaried Mgt has been banned from checking out equipment. When we first got the lockers, Salaried Mgt could check out anything but they were so lax about who they gave stuff to and it never get returned that they can no longer check anything out.

  I guess it was found out when departments went looking for their equipment and then went to Claims to see who had it out. Turns out the Claims Supvr wasn't even working this weekend. 

 My first thought is that's and ethical violation.  Comments???",1.0,1,17
walmart,1622584367,nq5og5,Wanting to work at neighborhood Walmart...,"I (20f) am out for the summer and just looking for a job for the next 3 months. I was considering Target, but after looking into it, I think neighborhood Walmart may be the better options. Anyone knows if there are any major differences in this Walmart compared to the supercenter? I’m not the biggest fan of Walmart and honestly I’m scared of how the hours/days may look, but paying for college will have working literally anywhere.",1.0,1,5
walmart,1622584120,nq5l8b,Accidentally claimed a shift,Is there anyway to unclaim a shift on the app?,1.0,1,2
walmart,1622583910,nq5ibh,“Your putting groceries back?” Me:“Yea?🤨🤨” Customer: “I don’t envy you” Me:”😐😐😐”,"Came into OGP today and I was doing returns today cause most orders after 3PM got cancelled so we had returns to do. I’m walking around with totes and items to place back on the shelf near juice aisle. 

Customers from online grocery can complain all they want i can’t do nothing about it so y’all wasting your breath talking to me. 🤷🏽‍♀️🤷🏽‍♀️💁🏽‍♀️

A guy with a scooter with 2 daughters, comes around to go to another aisle and asks if i’m putting stuff back and I respond:  “Yea, I am”🤨🤨

( if i heard him right )

Customer: “ I don’t envy you” 

🤨🤨( I don’t envy you either,  lose some weight my guy and get off your ass)",1.0,1,8
walmart,1622583443,nq5bzr,Scalpers ruined my experience.,"recently just got back into collecting pokemon cards and I was actually super excited to get back into the hunt.. It's been a really really rough year for me with back to back issues, so it felt good to feel some sort of happiness or to finally look forward to do something for once.

 Sadly that didnt last very long.

Now look, i haven't bought pokemon cards since 2006 waaaaaay back in my native country of Venezuela and i'm saying this because the process of buying over there is WAAAAAAY different  (Also i was like 7 so it really wasnt me buying them haha)

Anyways, I go to walmart (8520 N Beach St, fort worth)and i genuinely don't have a single. fucking clue. where these cards would be, so out of instinct i went to the toy section and of course NOTHING. Puzzle section. NOTHING. Book section. NOTHING. Electronic/collectables. NOTHING.

So after looking like a weirdo for an hour..a whole 20 year old in the toy section of Walmart... i kindly asked a nearby worker ""where would the pokemon cards be located if you had any available?"" she didn't know, which was fine because i didn't know either so who am I to say anything😂 but she kindly directed me towards ""the guy that handles all of that stuff"" so i went over and asked the same question showing him a picture for reference... And god damn i might as well have said ""hey fuck you you piece of shit where the Pokemons at"" because without hesitation in this extremely shitty, loud, aggressive tone the dude says  "" I CANT HELP YOU WIT THAT, I CANT REALLY TELL YOU WHETHER WE HAVE ANY IN STOCK OR NOT YOUR GONNA HAVE TO DO WIT WHAT WE HAVE"" 
(Loud, waving his arms everywhere)

So now he got me sitting here confused as to #1 why the fuck he's talking to me in that matter and #2 why he even brought inventory up..  Mr.big nuts over here literally over threw my whole question with whatever the fuck he was babbling about.. so again i ask ""where would they be located if you had any Pokemon cards?"" 

He replies with ""in the front""(not even an isle #) at this point. Fuck you. i walk away.. and as I'm walking away i hear him call the coworker i originally talked to saying ""these kids will take all the inventory and leave nothing behind for anyone that's why you can't tell them of we have anything"" (LOUD)

Like what in the fuck just happened?? 

Yes. I GET IT. People are shitty. people will take all the inventory and leave nothing for anyone like assholes, BUT who the FUCK do you think you are putting me in that category without knowing my intentions??? Specially as I'm politely asking you where an item is LOCATED.
 I'm not asking you about ur fucking inventory you piece of shit.

Took me a while, but i ended up finding the special bullshit isle where they were supposed to be and surprise, surprise. Nothing.

This was such a shitty and toxic experience... Ya boy was simply trying buy packs locally and i get shit on.

 I got hella pride, but even without pride no one wants to be accused of being a greedy scum bag. 

Fuck you to the scalpers for GOING NUTS LATELY and FUCK YOY to that big bodied bitch with glasses in the electronic isles. 
Fucked up my whole day.",1.0,1,5
walmart,1622581809,nq4pmm,OGP is now the KGP according to a coworker of mine.,,1.0,1,5
walmart,1622580123,nq420m,Covid leave question,"I had to miss 4 days of work last week because of a failed health screen, they said that the absences will be excused on the policy page on Walmart one, but will or can I get paid? Trying to figure it out, the app says my estimate return to work date is today? I called off every day like the app said under the covid-19 option but didn't contact sedgwick.",1.0,1,7
walmart,1622579320,nq3qmd,Will my covid leave be paid? How can I check?,"So on may 25 I failed my health assessment because I had diarrhea. My coach and a team lead told me to take a covid leave either until I can get tested and get a negative result or until the date it tells me. So I've been out.

But on my Sedgwick on one walmart it shows that it's continuous personal LOA for some days instead of COVID leave. 

Basically how do I know if this leave will be paid or not?",1.0,1,9
walmart,1622577507,nq314o,Most memorable customer award goes to...,"So, I’ve been working in OGP for 2 years now, I for the most part know how to deal with most pick-up situations that may arise. Customer service called down for an OGP Team Lead to deal with a customer complaint but the TL was busy at the time so i offered myself to listen to the customer and see if there was anything I could do to help him while he waited on our TL. He explained (very angrily may I add) that his order was delivered to his house and left outside in the rain. All his groceries were soaked. I apologized for the inconvenience and at this point my TL showed up, (mind you he just got promoted to OGP TL and has no idea WTH he’s doing) i stepped away for a moment and when I returned the customer somehow was even more pissed and giving my TL major attitude. My TL asked me if I could look up this guys order and I said “of course” so I turned to the customer and asked him if he could pull up his order number for me. He gets really dramatic and smacks his lips like it’s such an inconvenience for him to do this but ultimately pulls it up. He flips his phone screen over to me to where I see his order number for a brief second before his finger touches something and accidentally his screen tab switches over to some  PORN video he’d been watching. I have NO idea how I managed to keep a straight face and simply tell the customer “could you go back the order number please? Your screen switched.” 
The way his eyes bugged out after he saw his screen will be engraved in my mind lol.
I know this isn’t the craziest story but I will FOREVER remember this dude from now on 😂😂😂. 

(Also, he seemingly calmed down a ton after this mishap lol)

Let me hear your crazy customer stories! I’m curious.",1.0,1,22
walmart,1622577068,nq2v2v,Senior hours 6-7am tuesdays,Any stores out there that actually abide by this? Or do yalls store just open the door for everyone at 6am? Just curious.,1.0,1,7
walmart,1622576412,nq2lsc,Fuck Walmart,Walmart Had An Open Interview Day This Saturday. Me Assuming Since It's Open Isn't Going To Be As Official And Professional As A Normal Interview Brought My Girlfriend Along. I Meet Them Outside We Talk For A Little Bit They Tell Me To Text A Number The Number Sends Me A Link To Apply And I Do. All The While I Have My Arm Around Her And She Has Her Arms Around Me And She Kisses Me On The Cheek A Few Times. They Call Me For An Official Interview Today. I'm Supposed To Meet A Guy For The Interview And I'm Sitting There Waiting For Him. Then This Cunt Walks Up Who Was There Saturday When I Was And She Says They Won't Hire Me Because Of My Girlfriend Being Affectionate With Me. Fucking Bullshit. Fuck Walmart And Fuck That Cunt.,1.0,1,13
walmart,1622575474,nq28is,Does anyone know where I can get the QR code signage for neighborhood market self checkouts?,,1.0,1,2
walmart,1622574685,nq1xjn,Where is the list for max positions now ?,I used to have it but now its gone.,1.0,1,5
walmart,1622573227,nq1cr8,???,Should you mention a misdemeanor in interview?,0.99,1,7
walmart,1622572184,nq0xno,Does the store manager have the power to suddenly change a shifts start time?,So I will not say the story number but I just want to know if the store manager can decide out of nowhere that a  certain shift needs to start coming in a half an hour early or does he have to get approval from home office? As far as I know this is apparently going to be permanent nobody really understands why,1.0,1,10
walmart,1622572068,nq0w1q,Should I switch to Asset Protection or stay in OGP?,I was offered an interview for Asset Protection and I was always interested in it but at the same time I’m having fun working for OGP should I take it or leave it?,1.0,1,15
walmart,1622571644,nq0pwz,How do you get hired here?,"So I've applied to two different Walmarts since they were closer to me. I applied to the first WalMart over a month ago but could not get in contact with the hiring manager for weeks after our interview and I checked my online status to see that I had made it to orientation but we never scheduled a time for it. Didn't help that nobody could get in contact with her or the co-manager since they would take random vacation days.

Second WalMart I applied for was over 3 weeks ago and this hiring manager had transferred my information to this location but in the process she lost my information and this prevented me from getting a background check, according to the vetting department. And I have a hard time getting in contact with her since she also does not answer the phone. How do you even get hired if no one answers the phone?",1.0,1,8
