subreddit,created_utc,id,title,selftext,upvote_ratio,score,num_comments
walmart,1623185363,nve2nj,Next Steps?,"Our store has 4 front end team leads. One of our teams leads is incompetent, to say the least. She freguently forgets breaks and lunches, will almost refuse to answer calls (sell alcohol, get change, do proce checks, etc.) At least twice she has asked associates to work off the clock. These are just her worse offenses. Before the change to Team Leads, one of the CSMs spoke to the FE Coach about her, and was told nothing was going to be done about it. At least 2 associates have quit and cited specifically her as the reason. Recently, another cashier went FE coach with specific details and examples from other cashiers. She basically made excuses for the TL. We dont think going to SM would be helpful. She has worked for this store for 20+ years. She was an HR person before we went to having just 1 people lead. What should we do next?",1.0,1,4
walmart,1623184717,nvdtcp,Milking the overtime,Our cap one lead is banking the ot but just wandering around.   She will never be caught cus they never come out of the office,1.0,1,7
walmart,1623184176,nvdlg7,My first pick on my first walk of my day. Anyone want a banana?,"This customer also ordered 6 bags of the 5lb clementines.

*Processing img pc5ocqvmp3471...*",1.0,1,7
walmart,1623183008,nvd52u,Can I tan in the roof of my car in a Walmart parking lot?,"You know, quite far from the doors.",1.0,1,17
walmart,1623181186,nvcg7l,Plastic Bags,"Many of you may have seen or heard something along the lines of all Walmart’s will be getting rid of plastic bags beginning July 1st. 

This is not the case. 

Maine passed a law banning single-use plastic bags. It was supposed to take effect in April of last year, but was delayed due to the pandemic. Maine is the only state currently making this change. No other areas will see changes to the bag offerings in their stores at this time. 

Other areas already had bans/costs associated with plastic bags. But nothing will change for them or for areas where there is no such law. Only stores in Maine will see any changes beginning July 1st.",1.0,1,20
walmart,1623180892,nvcc83,Got coached at end of my shift last night for pushing more than 6 carts.,I was the only cart pusher that day.  How am I supposed to keep up with customers?  They never send help either.  Hate working here.,1.0,1,28
walmart,1623180667,nvc96c,Please tell me there is an easier way to change phone extensions,"I used to be able to dial 400 and change an extension in 30 seconds. Ever since they updated the phone system, that no longer works. Apparently the only way is to submit a ticket. It's been 5 days since I submitted one and absolutely nothing has happened. Please tell me there is an easier way to do this.",1.0,1,1
walmart,1623179813,nvbxqs,Is Walmart going bagless July 1st?,,1.0,1,4
walmart,1623179396,nvbs0b,No wine or beer using Walmart Pickup?,"I use the very convenient Pickup service offered by Walmart. It's great to load my online cart during the week, and then schedule a pickup time. All of a sudden, they have stopped offering beer and wine for pickup. I can find nothing online about this change. A live chat with them yielded no answer.  Kinda bummed about it. Now I have to go into the store for those items if I am having a get together at my house (or just for me!) Anyone have further intel? I like the whole contactless delivery to my car.",1.0,1,8
walmart,1623179280,nvbqfb,Feel like shit,What am i supposed to do if i feel like shit woke up stomach was a lil upset no fever tho so i go in and i had to use restroom 5 times in an hour should i just clock out and go home or am i too deep in its 2hrs into shift,1.0,1,20
walmart,1623177967,nvb8ob,I'm renaming it,"Sedgwick.   

To Smegmawitch.

That is all.",1.0,1,1
walmart,1623177298,nvazvm,Coin Shortage,We've been having a coin shortage and had to make all our Self checkout cards only. Talked to a friend in a different state that said his Walmart just started that too. Anyone else having this issue? Is it going to be just like last summer?,1.0,1,7
walmart,1623177184,nvayg1,It’s over at last,"Obligatory customer promotion post.

I started back in December as an overnight stocker with a rinky-dink skeleton crew, and I’m rather impressed with how many people we’ve managed to hire (and retain) since then. I’m only quitting because I need to study for my programming certifications and can’t do overnights anymore at the cost of my health/social life. 

Despite the horror stories I’ve read on this sub, I’ve surprisingly come to enjoy my time at my store. Whether or not it’s Stockholm syndrome is a question for another time. And as much as I hate to admit it I’ve actually grown quite fond of my coworkers/managers, and I feel a tad guilty leaving them with inventory in a couple weeks. 

Overall I’d give Walmart a solid 5/10. It’s a job that exists and pays decently above average, not sure I could really ask for more.",1.0,1,1
walmart,1623176669,nvarrs,Where can I find information on the Covid vaccine$75 and paid days off for second dose if you get sick. I just want to find the policy.,,1.0,1,2
walmart,1623175849,nvago6,Fun times at work yesterday...lol not really,"
State health inspector was my location yesterday. I didn't know they were from the state (cause I didn't look at their badges lol.)until my team lead pointed it out. He didn't know at first either because his shift started after they had got there. Anyways I told I thought it was odd they didn't know about the black labels for the hot case. I had explained why we did have any in there (old ones accidentally got messed up) However new ones had came in but I did know that. Anyways I was asked about cleaning the slicers. It was the state health inspector, a person in training, the two bakery team leads and the co-manger all there while I spur out the answer.  Good thing I've answered the same question a handful times in the past.
They were at my location from before 11 am until  after 4pm. Although they did take a little break for lunch.",1.0,1,2
walmart,1623175791,nvafw1,Finally Free,"I just moved and had the opportunity to transfer to a new store but I just couldn't do it. I'm promoting myself to customer and getting the hell out. 
I worked at my old store for a little over a year and it was one of the worst experiences of my life. I'm so happy I don't have to deal with managements or customers shit anymore",1.0,1,4
walmart,1623175596,nvad93,New Samsung phones in New Hampshire?,"We got a new store manager yesterday after having been without for a month, and he was talking about how he out in a ticket to request the phones, but said that because we’re in New Hampshire, and no -BYOD state, we probably won’t get them. I thought the whole point of these was to get around the BYOD limitations?",1.0,1,7
walmart,1623175075,nva6ah,Vaccine leave,"So me and my bf got our first shot today and if we have side effects, how do we go about getting the days off after? I know we are supposed to use Sedgwick but this would be our first time using that, so we're pretty new to it lmao.",1.0,1,7
walmart,1623174028,nv9sal,New to Fresh Cap 1. How am I supposed to do it all?,"Transferred to Fresh because they got rid of Cap 1 at my store and I just gotta say: what the fuck. How do they expect one person to do it all? Unload truck, stock picks, cull, CVP, cap and work the bins, etc. I’m by myself. How the heck is it supposed to get done?! I’ve been doing it only for a few days and it seems impossible to do everything by myself.",1.0,1,18
walmart,1623171770,nv8xjq,Full Time,"I don't trust the HR guy or any of the managers to provide accurate information. Does anyone know if they changed the full time hours from 36 to 38? They are saying that's the case, but I want to double check, because everyone here has helped me out a lot with accurate information. 😁",1.0,1,12
walmart,1623171677,nv8wb0,New app not working properly,I don’t know if anyone else is having this issue but everytime I get a request to trade shifts I am unable to actually view it and accept or decline it. Please let me know if you’re experiencing the same issues.,1.0,1,3
walmart,1623169853,nv86xo,Shortages,"There's a shortage on plastic containers for the deli.  There's a shortage on mustard and ketchup packages. There's a shortage on bread for the sandwich kits.  They still send the kits even tho they don't send the bread.  The kits have a short shelf life.  We get the bread within a day or 2 of the kits going out.  So we go from no sandwiches for a week or 2 to 48 sandwiches that have to go on a wall that fits 8 in 2 days.  And a store manager that thinks we do it on purpose.  And just to make things interesting, the system updated during fry yesterday so we couldn't print labels.   If I didn't enjoy living inside so much, I'd quit.",1.0,1,6
walmart,1623169576,nv833x,Photo lab USB,Can anyone help me I have someone who ordered a USB but when I stick the USB nothing happens am I suppose to click something on the screen,1.0,1,4
walmart,1623168116,nv7j2q,Hit 5.5 points...how long before they notice?,I called in sick around 9 days ago and didn’t realize it was a key event worth two points. Im now way over the 4.5 threshold and wondered how long I have before they notice and fire me?,1.0,1,8
walmart,1623167991,nv7gzl,End of an Era,"So! Now that so many of us are vaccinated and the 5th of July gets steadily closer it seems the company itself sees Covid as good as done. How many covid leaves did ya'll wind up with, now that it's over? I know some people in the store have had 4+ and we have had a few leave us during them (Front end. Yay). Anyone take them post vacc? I know the immunity is high but im still worried that the company is dropping the policy so people will be coming in potentially carrying it to those who can't be vaccinated.",1.0,1,21
walmart,1623167721,nv7d4l,Will I still receive my W2 if I’m not in the system anymore?,"Basically title. My last day was yesterday thankfully, but I’m just curious what happens come January. I’m assuming I won’t be able to log in anymore, so are they still gonna mail/email it somehow?",1.0,1,4
walmart,1623167594,nv7aao,Weekly Salt Thread 207 - The Nintendo Switch NO! is never in stock,"Disclaimer: Don't be disrespectful, don't be rude, don't be racist, homophobic, sexist, etc, etc, etc. This thread is to let y'all vent about whatever you want to vent about while working at wally world may it be customers, co-workers, managers, etc.

If you have any title suggestions, feel free to leave them.

[Last week's salt thread](https://www.reddit.com/r/walmart/comments/nosy0s/weekly_salt_thread_206_schools_out_sale_now/)",1.0,1,88
walmart,1623166930,nv6wmw,Hiring Question,"Hi all,

I just got my background check approved yesterday morning and was wondering how long it took for the hiring manager to call about orientation? 

Also, should my career portal have been updated to say “orientation” instead of just “offer activities”? I’m worried that there may be an issue as I transferred my job offer to a different store.

Thanks so much! I look forward to working with some of y’all.",1.0,1,0
walmart,1623166289,nv6jxs,"Trying to accept job, saying my SSN is invalid","As the title says, I recently got a job offer from Walmart.  I need to verify my contact info and whatnot for the background check, but it doesn't like my Social Security number.  I've tried on PC, iPad, and Android phone, as well as two browsers on each.  It doesn't let me use dashes so I assume that isn't the issue.  Anyone have any advice?",1.0,1,0
walmart,1623165336,nv6an7,Employee here. How can I view my Walmart start date?,,1.0,1,3
walmart,1623165326,nv6akj,Thank you maintenance,For giving me a extra half hour break guarding a spill cause no one will come and help me take care of it,1.0,1,4
walmart,1623165134,nv68xy,Call Walmart about orientation?,"Today is Tuesday, went in Friday for interview as an Automotive Technician, interview was great, TLE manager called and guided me through the online background check and drug screening. Said they should call Monday for orientation, Went Friday evening for my drug test. And have not heard from them. I’m guessing their waiting on the drug test and/or background  to come back before calling me. Should I call Personal or just wait?",1.0,1,1
walmart,1623164798,nv65sf,TIL you dont need a barcode to scan jello,You can use the TC to scan the front of the box and it'll scan just like if you pointed it at the barcode.  It only worked on the great value sugar free jello.,1.0,1,2
walmart,1623162779,nv5eqi,Academy Testing?,"Going to the Academy for the first time tomorrow.
Anything i should expect/bring?
Is the testing difficult?
Thanks",1.0,1,5
walmart,1623162429,nv5a2c,Do you tell management/TL when you go on your 15/lunch?,"Mine just stare at me like I’m stupid yet get mad when they can’t find me 🙄

[View Poll](https://www.reddit.com/poll/nv5a2c)",1.0,1,0
walmart,1623161105,nv4s76,Byod tablet help - screen time out,"Hey, I was wondering if anyone could help me.

We have an iPad mini at work mirrored to a TV so we can see our dispense screen for Ogp but the screen keeps timing out. There's no option in settings for it to turn off 'never'. Theongest is 15 minutes. Is this because of restrictions placed on the device from byod or should I look for another tablet?

Thanks for your help!",1.0,1,7
walmart,1623160241,nv4h5q,Pregnancy question,So i’m currently 12 weeks pregnant and have an upcoming drs appointment where they will “give me a list” of restrictions. My question is - do I need to contact Sedgwick and submit them or do I just give them to my coach/team lead? My pl leaves a lot to be desired so that’s why i’m posting here. Any help would be appreciated. Thanks!,1.0,1,3
walmart,1623159789,nv4bip,How to add vispick to my iPhone ?,[removed],1.0,1,0
walmart,1623158901,nv40rj,Night shift maintenance here 👋,"Hey guys so I finally decided to look for any Walmart groups and of course this is my first stop lol, just wanted to say hi to my fellow associates. I’m night shift maintenance at a neighborhood Walmart and I’m sorry but I’m the guy walking around with a loud ass speaker 😅",1.0,1,27
walmart,1623157878,nv3ozs,How many negative effects would stepping down have?,[removed],1.0,1,0
walmart,1623156812,nv3ctk,Point help,"I know if I use PPTO and call in it'll be half a point, but my Coach told me that it would only do half a point if I had enough PPTO to cover half a day - is this true, or will any amount of PPTO work for only half a point? I've been through a rough fucking week and I racked points up like crazy, and I'm exhausted from being in the ER for a potential stroke until midnight yesterday. I just need help. Please.",1.0,1,4
walmart,1623156372,nv3827,APIS,"Hey guys I’m new to my role and I can’t seem to approve cases in APIS. It seems as if I have all the options but when I go back to my case report all the cases I’ve just reviewed and closed out are still showing. 

Please help!!!",1.0,1,3
walmart,1623153073,nv29nj,Do I need to contact People Lead when calling out for vaccine side effects or can I just wait till I return to work to do so?,Have seen some say contact PL when calling out but I’d rather just wait till I get back as I don’t like calling them. I just plan to select covid event when calling out and showing my PL my vaccination card when I return. That should be good?,1.0,1,6
walmart,1623150844,nv1lqv,Walmart Radio- Always In A Mood,"Have you noticed that they'll play snippets of ""Always In A Mood,"" by 24kGoldn? However they always censor the words ""depression,"" and ""be a victim."" Since when is ""depression"" a bad word???",1.0,1,8
walmart,1623143855,nv0mwa,I admire your drive and work,"I did cashier for a whole hate months before I quit. I have flat feet ,standing is annoying.

To the people who zone and those who so curbside shopping. You are awesome. Because of this community I put stuff back where I find things.

Little story yesterday  I went  to my local Walmart for a monitor and a stapler. Most monitors were out but the one I wanted the least bc of the price was in. I went to look for the stapler but got distracted by the notebooks as usual ,found an updated planner. ( I am trying to stay on schedule but most of the time ,I fall on it and the planner expires on me ) so I look for its family so I can see the price, nowhere to be found not even a similar cousin. So I used the app scanner thingy to get the price which I did get but the app also told me the item I was holding in my hand was out of stock. 

I still work in service so I still get the mean customers and others stuff but now I feel your pain when it comes to zoning and misinformation about stock.

Thank you guys from a fellow service gal.",1.0,1,5
walmart,1623143334,nv0i4g,Key event days,Does anyone know if today is a key event day?,1.0,1,5
walmart,1623138643,nuzdb7,Is there any written company policy for the time it takes to zone an area?,Basically management is super in a fit over time breaking things down to the exact hour and minute. I'm looking for some written policy for how long it should take to zone a given area as they're expecting me to get the whole store zoned with 6 people in an hour. Anything helps.,1.0,1,15
walmart,1623138083,nuz8ej,Had my night made,[removed],1.0,1,0
walmart,1623137932,nuz72e,Quitting/giving notice,[removed],1.0,1,0
walmart,1623137715,nuz59c,Pregnant question,[removed],1.0,1,0
walmart,1623134541,nuydci,Chill out Matt,[removed],1.0,1,0
walmart,1623133693,nuy5xt,TLE uniforms,[removed],1.0,1,0
walmart,1623133409,nuy3fx,TLE Uniforms,[removed],1.0,1,0
walmart,1623132606,nuxwc6,ACC Uniforms,[removed],1.0,1,0
walmart,1623132506,nuxvec,"People who have moved up higher than an associate, how did you manage to move up and what are your tips?","Hello Reddit, I've been with Walmart a little over a year now and I personally don't mind the job.  I have been considered for a team lead position and it got put on hold indefinitely lmao.  I got a question for everyone who has moved up higher than an associate though.  How did you manage to move up in the wonderful world of Walmart?  Is it worth the pay?  I've been busting my behind for the past year and a half and almost reached my goal of team lead once but have been kind of cancelled since our store manager moved locations.  Any tips or anything would be appreciated.",1.0,1,13
walmart,1623132487,nuxv7z,Wtf,[removed],1.0,1,0
walmart,1623132005,nuxqvi,I finally quit my job,[removed],1.0,1,0
walmart,1623131343,nuxkyi,Should I just see what happens,[removed],0.99,1,0
walmart,1623128038,nuwpgm,Why do so many people fart in Walmarts?,[removed],1.0,1,0
walmart,1623127030,nuwfk5,Apply for a job in Walmart,[removed],1.0,1,2
walmart,1623127029,nuwfjw,transfer not going well (vent),[removed],0.99,1,0
walmart,1623127001,nuwfat,"Can I do CBLs, uLearns, off the clock? I need to get them done but never have time and I don't want to be late on them.",[removed],1.0,1,0
walmart,1623127000,nuwfa5,Finding a job in Walmart Canada,[removed],1.0,1,0
walmart,1623126781,nuwd2e,The Overnight Management,"This guy from overnight who was apparently a Cap 2 supervisor wasn’t chosen for a team lead role 6 months ago because he’s a douchebag. His words not mine. Then he proceeds to trash cap 2 for not being trained properly, which we aren’t, and basically says that he is the only reason that this store is running well. It’s not though. Cap 2 would get more done in 5 hours than overnight does in 10. Sorry this is all over the place but this guy pissed me off one time and I’d never so badly wanted to punch someone in the face.",1.0,1,3
walmart,1623126691,nuwc6f,I start 8 days in a few hours,[removed],1.0,1,0
walmart,1623126612,nuwbc5,How hard is finding jobs in Walmart Canada?,[removed],1.0,1,0
walmart,1623126440,nuw9pm,I start 8 days in a row in a few hours...,[removed],1.0,1,0
walmart,1623126000,nuw5a8,Current Hold Music,[removed],1.0,1,0
walmart,1623125873,nuw41d,Walmart sold me a battery I can't return,[removed],1.0,1,0
walmart,1623125850,nuw3t5,Vaccine call out question.,[removed],1.0,1,0
walmart,1623124188,nuvmd4,Returning an Everstart Battery,[removed],1.0,1,0
walmart,1623123818,nuvih1,Coaching Question,[removed],1.0,1,0
walmart,1623123226,nuvc7i,Assessment Test?,[removed],1.0,1,0
walmart,1623122885,nuv8l5,New Samsung phones in New Hampshire?,[removed],1.0,1,0
walmart,1623121534,nuutvx,Ordered a Vinyl LP and got a CD,"I ordered a Vinyl LP of The Mouse and The Mask by DangerDoom on the Canadian Walmart website last week and i received it today, only to find i received a CD... How do i go about getting the Vinyl i ordered or receiving a refund, i payed $49.00 for it.",1.0,1,2
walmart,1623120913,nuumud,Family drama should I let management know,[removed],1.0,1,0
walmart,1623120442,nuuhpd,Question about stage two covid leave,"So I got food poisoning, although I didnt know that it was food poisoning when I did the health screening last night, and it told me to stay home for ten days and to contact sedgwick.

Since then I’ve been to the doctor, and tested negative for covid. I haven’t initiated the leave yet.

Do I still need to go on a ten day leave or do I just come in the next day I’m able to work?",1.0,1,3
walmart,1623120410,nuuhcu,Bagless.,[removed],1.0,1,0
walmart,1623120327,nuugfb,Covid screening question,[removed],1.0,1,0
walmart,1623119500,nuu72g,Coworker accidentally thew my printer down the trash compactor...,[removed],1.0,1,0
walmart,1623117389,nutjkd,How many points for being late? How many for not showing up without calling?,,1.0,1,21
walmart,1623116193,nut6ft,My schedule randomly got removed without notices?,"So I've been working for nearly 3 months, and out of the blue, my schedule was just.. changed? Like I had these next two weeks scheduled but oddly they removed it without any notices, and no it's not a paid leave (I think) nor taking a break?

I don't think it's even the points but I don't know...

Am I being fired? I'm pretty scared since I'm working full time :,) do I need to talk to an ASM?",1.0,1,13
walmart,1623115717,nut11o,Time off,[removed],1.0,1,0
walmart,1623114886,nusqyx,How does calling off the day after you get a COVID shot work? My co worker said he was not pointed and that it was paid for. I’m already at 4 points with no time available so I don’t want to get fired.,,1.0,1,11
walmart,1623114823,nusqam,Bags.,[removed],1.0,1,0
walmart,1623114171,nusj4d,Pharmacy systems,[removed],1.0,1,0
walmart,1623113954,nusgid,"AMP: RIP OBW; TLs SOL, LMAO",,1.0,1,3
walmart,1623113262,nus8m4,Shifts Cancelled?,So I just checked my ME@Walmart app and it lit up saying all my shifts after this week were cancelled? Not really sure why.,1.0,1,20
walmart,1623111518,nuroxn,Accidental no call no show,[removed],1.0,1,0
walmart,1623111478,nurohr,Frozen boys don't want to help cap 1 cause we get paid $2 more,[removed],1.0,1,0
walmart,1623111099,nurk2t,"Please convince me not to ""promote"" myself",[removed],1.0,1,0
walmart,1623110336,nurb0w,"Finished my second day, already want to be a customer again",[removed],1.0,1,0
walmart,1623109994,nur77i,Any other walmart delis dealing with scale shenanigans?,[removed],1.0,1,0
walmart,1623109639,nur38j,Water,Am I allowed to leave the garden gate to get some water. It's 100 degrees where I am,1.0,1,13
walmart,1623109320,nuqzj6,I am so tired.,[removed],1.0,1,0
walmart,1623109230,nuqyh7,Why do some people care so much about a $2 dollar difference ?,[removed],1.0,1,0
walmart,1623108832,nuqtxr,Virtual Meet And Greet,[removed],1.0,1,0
walmart,1623108609,nuqrd7,Stupid new rule/longish rant/message to my coworker,[removed],1.0,1,0
walmart,1623108576,nuqqz6,"Lottery CBL, why me?","I'm dialed in as a food associate. Why am I getting a lottery CBL, that upon completion, pretty sure said i'll have another assessment in a few weeks.

Why lol I'm not transferring positions or even register trained yet.",1.0,1,7
walmart,1623105529,nuppal,Can I be asked to wait to use the restroom?,"So we are understaffed today, like usual. We have our CSM and our team lead up front. Then there’s me, two other cashiers, and a cashier who is now in ogp but is helping cashier right now. 
I’m working at 5.5 hour shift today. 
Anyway, our team lead is on lunch, one of the actual cashiers is also checking people out with the ogp/cashier. The other actual cashier (let’s call her Carly) just went to her first break, even though she got here an hour after me. I still haven’t had my break at this point, but whatever. She said I could go after the other girl. My csm is watching bullpen and I’m watching belts. I suddenly really have to use the restroom, so I tell my csm “hey I’m going to use the restroom”
She has the audacity to ask me “can you wait and go on your break when Carly gets back.”
I’m sorry. I didn’t realize I’m a kid in the back of a car on a long trip. Is that even legal? To ask someone to wait to use the bathroom. 
I would like to point out that my team lead takes legit 10+ minute bathroom breaks.",1.0,1,6
walmart,1623105308,nupmfw,Advice for my first interview,[removed],1.0,1,0
walmart,1623104802,nupg0q,How long after background check...,[removed],1.0,1,0
