subreddit,created_utc,id,title,selftext,upvote_ratio,score,num_comments
walmart,1623481278,ny0t2k,"The whole meat wall, in one night?",Is that even possible?,1.0,1,15
walmart,1623479940,ny0hk4,Early Lunches,[removed],1.0,1,0
walmart,1623477525,nxzwvb,Cap 2/Overnight Team leads,"Due to unforseen circumstances, I was not able to apply for food and consumables as originally planned, kind of glad at this point because a overnight TL and a CAP 2 TL spot has opened up, and staffing has gotten significantly better. I don't know which one I would like to put in for however, I think I'd be great at both.

Current CAP 2 Leads and O/N leads what are the pros/cons of your shifts? Does cap 2 lead have rotating shifts? Also, at my store O/N TL currently make 24$/hr, no idea how much cap 2 makes, I assume 22$? Regardless... Pay isn't super important to me, just was curious!",1.0,1,14
walmart,1623476491,nxzndf,Finally promoted MYSELF to customer,"This is going to be a long one so buckle up, first I just wanna say how happy I am to have found Reddit to be able to talk about things others know about and relate to. Its really nice to have people on your side who get it lol. Now we all know that working for Walmart is absolute ass and I WILL not ever go back. 

I originally came from a store in CA and transferred to OGP. at first it was all great and I loved it, that only lasted a week or 2. After being treating horribly, yelled at every day, had sexual comments made to me and other co workers daily &amp; getting pulled in for a supposed coaching (which they never went through with because the “system was down” which that isn’t a thing) I had to get out of there. I was promoted to team lead over apparel. 

I’ve been over apparel for about 6 months now and I came from apparel in CA so I did have knowledge and I was very capable. I was incredibly happy about the pay increase because 18.36 an hour is decent and I felt like I had a good handle on things. Oh was I so naive, not only is the new store I’m working for the WORST store I have ever worked at, it’s also the most drama filled. 

Management has no idea what they are doing, they can’t ever communicate about anything and that makes it hard for us TLs because we will give one direction and then management will come along and change it up with no communication. So not only were the associates confused on what their actual job was, we never got things done the way the process was supposed to be. 

One of the associates I had is one of the worst people I have ever worked with and is constantly starting drama for no reason, yells at us and demands we do something for her the minute she asks for it. On top of that, she would text me constantly just being a bully and it was just all too much. 

Management had a rule that they had just told the associates and that was they were not to be texting or calling us (TLs) when we weren’t on the clock. So tell me why my coach would text me constantly while I’m not even there?? 

I had gone to the store lead about an issue that had been happening for a long time because according to the chain of command that is who I was supposed to speak to and instead of him taking me seriously, he went around the store saying that I didn’t know how to do my job and all I did was bitch an complain. 

There is SO much more I wanna write and vent about because I’m just not okay mentally after working there anymore &amp; I know this post is all over the place but tomorrow is my last day and I couldn’t be more excited to never have to go there as an associate EVER again because I refuse to be treated that way ever again. I got a new management position at a place I LOVE to shop at so hopefully this will be a good thing for me. If anyone else wants to vent or talk about anything in this thread please do because I would love to talk to y’all about all of the fucked up shit that has happened while working at Walmart.",1.0,1,9
walmart,1623476227,nxzkvz,Pointing out after putting in your two week notice.,So I submitted my 2 week notice yesterday and I'm at 4 points. Something came up tomorrow that I kinda need to attend. What's the likelihood that they'll fire me for points before my two weeks are up considering we're short staffed?,1.0,1,11
walmart,1623476044,nxzj9q,do they drug test?,I just got a job at my local walmart as a truck unloader but i’m not sure if i’ll get tested or not?,1.0,1,8
walmart,1623475101,nxzalp,Is there a way to limit hours or availability online?,"Basically, they scheduled me for 39 hours, as a part time employee. 

I told them I was flexible, but still have classes in the summer. 

Is there a way to limit the total average weekly hours online, or something... If this is how it's gonna be, I will hand in my 2 weeks lmfao.",1.0,1,7
walmart,1623474356,nxz3pl,I'm frustrated and haven't been given the raise or backpay they promised in almost a month. I need some advice.,"So there's quite a bit to unpack and talking to management has walked me in circles. 

To start off I began a transfer right before our personnel coordinator moved stores we also got a brand new store manager who says he doesn't have his options available to him yet and we have yet to get a new coordinator. I moved from door to OGP which was SUPPOSED to be a nice raise and more hours. My personnel coordinator and OGP manager told me to go ahead and start working OGP the 21st of last month. I've been working OGP 40hrs weekly since then however I never got transfered or filled any paper work. They keep saying I'll get my back pay (mainly my OGP manager) and not to worry about it but the OGP manager refused to even try and help me fill out the transfer paper work confirming my new position until I talked to our SM. Then literally an hour later she had everything pulled up and ready for me to sign. Now I'm missing almost a months worth of pay for the raise and I haven't even gotten my pay bumped to the OGP raise because I need to wait for the new pay period? I should also add my OGP manager lied to me when I asked about the transfer request and said she couldn't help me and we'd have a new personnel coordinator by the end of the week last week (talked to the SM he said it'd be minimum another month and she KNEW THIS)

Long story short I'm debating just calling ethics hotline but idek if that'd do me any good. I have a bunch of bills to pay and had planned a bunch of future expenses around this raise and I want my money now they are saying it'll take another pay period just to receive my raise not even what I'm owed. 

What can I do? Do I even actually have any options?",1.0,1,13
walmart,1623472393,nxykqq,got written up today for my coworker leaving the radio on a cart and not telling me.. manager was mad because we were standing in the shade for 30 seconds because it’s 91 degrees out,,1.0,1,12
walmart,1623471257,nxy9c1,calling out on the weekend?,"im sure this is a silly question, but i must preface this by saying im asking for a FRIEND, i keep hearing mixed info on whether you get double pointed on weekends or not, just thought id ask. neither saturday or sunday appear to be key event dates, also.",1.0,1,5
walmart,1623470615,nxy2vd,"My lunches are always last, and late.","I'm a door host and the closer. I clock in at least a half hour after all my co-workers. 

We have a routine set up where someone goes on break or lunch then the covers the next and it forces a rotation. My breaks and lunches end up being last since I'm last to clock in. I usually don't mind, except my lunches always end up late, too. And I've talked to them about this. 

We have two door hosts that are dating and they always have to rotate who takes their lunch first every other day. And two door hosts who always have to have their lunches and breaks on time, and one who can never be back on time. 

I don't mind my lunch being half an hour late, but when they force me to be an hour or more late for my lunch without asking me, without saying ""Hey, I'm running late from lunch."" Or ""My lunch got to a late start, I'll be late covering yours"" that pisses me off, especially when they have the audacity to get pissed at me for asking over the walkie when is my lunch gonna get started.

Fuck it, I'll just start walking off and taking my lunch when it's due.",1.0,1,8
walmart,1623469870,nxxvc8,“Attention Walmart associates…”,"“Attention Walmart associates, u/bottleoftrash you’re needed to lawn and garden”

10 minutes later:

“Attention Walmart associates, u/bottleoftrash you’re needed to hardware”

10 minutes later:

“Attention Walmart associates, u/bottleoftrash you’re needed up front to check please”

My manager (who literally called me to all of these places): “You should have finished the dog food pallet by now.”",1.0,1,11
walmart,1623468947,nxxls7,First day tomorrow as a temporary remodel associate,had orientation today and my first day is tomorrow . my position is temporary and part time but im working 9 hour shift 5 days a week . is that not full time ?? im nervous bc of that and this is my very first job . im just wondering what would i even do for 9 hours as a remodel associate … but i was told if i didnt have any remodel duties i would be working on things like stocking . idek what to expect,1.0,1,12
walmart,1623468862,nxxkxe,The chosen one ?,"Okay so a TL position became  available in Ogp, Digital, OPD (whatever it’s called they always change the name) anyways I got a interview last week.  I’m asking how do you know you have the been chosen ? Do they tell you after the interview or do they tell you after they interview all candidates?  (They interviewed 7 people) A little side note  I’ve been in Ogp for 4  years. I kinda shadow the mangers I’ve learned a lot (basically kissed ass to see how the department works).  Also how important is the interview because it didn’t go well . I believe I’m a good candidate but the interview surprised me I did  not think they would chose me as a candidate because  there was multiple people who applied like 25 people.  If you reach this point of my post and decide to reply I just want to say thank you for your feedback!",1.0,1,18
walmart,1623466012,nxwqyw,Teaming,"Okay, I like my job when I can get around it and stick to it. Being a team lead , also involves being over  your department and the store as a whole, it’s fine at times.  Most days times it’s frustrating, walking in with a plan , which gets ruined with notes, freight pilled up ( not ours ) staffing , you get the point. I subconsciously want to stay in my area and make it 100% as I can , but other team leads needs help and I will would assume I’ll get help in return if I need it. If I don’t help , then salary with tell me to help or the leads will complain that I didnt show up to help , while I’m trying to teach/train my associates and then get fussed at for not having our processes done , while they are also pulled , because if I don’t pull my associates to help other areas then they will complain.  I don’t think I’ll get the help from others outside my area like we help others. It’s getting us behind and bitched at sometimes, but it’s Walmart.",1.0,1,12
walmart,1623465718,nxwnvd,Those people who won't leave after close,I work nights I was wondering why do people constantly come to the store 10 to 5 minutes before we close and try to buy a months worth of crap. Go home go anywhere but here and if you're still shopping after we close at 11 You're no longer a customer you're vermin.,1.0,1,12
walmart,1623464006,nxw5sz,"Ugh.... I'm in the MEAT department, putting MEAT on the shelves, and these idiots have to ask...","""Do you work in the meat department?""",1.0,1,21
walmart,1623463347,nxvysh,Linz,,1.0,1,1
walmart,1623461041,nxva73,Can I request time off and how?,I’ve been working at Walmart for about 8 months I’m a part time worker (despite working 40 hours a week 😒). I’ve worked weekends ever since I started I need a weekend off for my mother’s birthday. I only have points in ppto but can I request unpaid time off or do I need points in personal or something to do it?,1.0,1,6
walmart,1623460776,nxv7g5,Does anyone else here find receipt checking to be very awkward?,"Whenever I ask for receipts, it feels stressful, even with the expensive things I saved (I saved an 80$ bike and a tent within a few hours of each other), I just hate not knowing how they would react, if I'll be accused of profiling someone, etc. I do what I can, but I guess I'm socially awkward.",1.0,1,12
walmart,1623459140,nxuq0d,Moving to a different area,"If I’m a team lead over an area and another area opens up, isn’t that just a move management can make?  Why would they want to interview me if I’m already a team lead?",1.0,1,4
walmart,1623458658,nxukn5,How much cash is in a typical drawer when counting them down? I’m a former pro supervisor at wal greens and we had 300,,1.0,1,6
walmart,1623457198,nxu540,got one on Walmart,Placed an online order for eight grocery items totally less than 20 bucks.   They are shipping them Fedex from five different locations according to the different tracking numbers.   Look like Walmart lost money since I had free shipping because of Walmart Plus.,1.0,1,10
walmart,1623456879,nxu1iq,Sexual harassment policy?,"An associate has been hornytexting a coworker of mine on Instagram, she has him muted but is afraid to block because he gives off incel vibes, and she's scared he's going to do something crazy if she blocks him. 
(Also, he's building a huge case for himself, since he keeps sending shit lmao)

She's also afraid to report, what can be done in this situation? And what would the consequences be for this? We both have numerous screenshots.",1.0,1,28
walmart,1623456600,nxtyct,Meat shortage,Any other walmart delis dealing with the meat shortage. We literally have 2 types of boneless chicken and just ran out of 8 piece 😂😂  also just ran out of mac and cheese lmao not sure what the hotbar will look like tomorrow,1.0,1,13
walmart,1623456598,nxtybs,Just promoted myself to customer,"Dealt with my fair amount of bullshit, but finally had enough. When it’s 98+ degrees outside and the only person you have hauling heavy ass shit is me, a smaller dude who has made it clear that I cannot perform well with heavy lifting, I’m done.

 Now this might seem little, but already dealt with a lot of bullshit working for this company. This was just the straw that broke the camels back. I’ve dealt with harassing TL’s, ridiculous expectations, toxic coworkers, the list goes on and on. There were a lot of days where I felt sick just thinking of having to clock back in to this hellhole.

The way Walmart lines up their schedules makes it hard to have any type of social life or enjoy life at all. I work, go home too tired to do anything, sleep, get up, and work again. Im constantly sore. I just kinda got to the point where I asked myself why I do this. There’s jobs here way more fitting for me that either pay more or the same. I have enough in savings to cover the whole summer, although I’m getting a job so I don’t have to dip into it.

Started looking into other jobs already and putting in, and just got the call from a vet clinic to fill the receptionist role. Yeah I’m gonna have to wake up super early now, but shit. I’ll be in AC, not doing ridiculous heavy lifting, all while getting paid the same.

Now this isn’t to shit on your guys jobs. I know most of you on this sub are actually hard workers. I’ve got hella respect for the “worse” departments in the store. 

You guys are worth so much more than what you deal with at this company. Whether this is just a job until you finish school, a part time gig, or a full on career for you guys. Take all your breaks. Use your PPTO. Don’t let this company take advantage of you.

Sorry for making a dumb long spiel on a damn Walmart subreddit. Just finally said enough is enough, had some self respect, quit, and now I’m celebrating.",1.0,1,13
walmart,1623455169,nxthne,Quitting Walmart,"Guys I can finally quit Walmart. Found someone willing to pay all my bills and spoil me with presents. 

Edit: never mind it was a dude. Back to work I go.",1.0,1,7
walmart,1623453165,nxsv8k,Help with the application process.,"So for context, my girlfriend and I applied to our local friendly neighborhood walmart warehouse yesterday and instantly received job offers today before any interview. We were filling out all of the required information like confirming the schedule and accepting the job offer.

Now here's where the issue starts, my girlfriend clicked next without realizing there was an option to schedule a drug test appointment. She went back to try to schedule it after I told her about the option, but she kept getting errors. We switched browsers and the website then said she already initiated the drug screening process. She hasn't received any emails about a place to go. All of this is required \*within\* 24 hours and all sources of contacts are closed until monday.

Anyone have any tips or advice? Is there another number that we can contact to help with the process? Or are we just shit out of luck. Thanks so much in advance.",1.0,1,2
walmart,1623453072,nxsuan,Substitution issues in grocery pick up,"Is pick up success different store to store? I’m new to using pick up and it’s been terrible so far, so I’m wondering if going to a different store helps. 

The substitutions I get are just completely crazy, and my pre picked substitutions are always ignored. Today I ordered those little hillshire adult snack packs with the salami, cheese and crackers and was subbed mini Hot Dog lunchables???? Stuff like that is just crazy. Attempts to pick a substitution or say no substitution have been ignored. I didn’t even have the opportunity to reject that substitution this time :(

Should I try a different Walmart? I hear such good things about pick up but I’ve had nothing but issues. The mini hotdogs are the final straw.",1.0,1,10
walmart,1623452884,nxss98,Question for employees,Can we take the pallets behind the store? Or is that theft?,1.0,1,5
walmart,1623452607,nxspac,Do you think Taylor swift is a virgin?,,1.0,1,4
walmart,1623449598,nxroxb,I lost my vaccination card. Can Walmart Pharmacy perhaps look me up in their system and give me a new one?,I got the shot in April in rural Pennsylvania location.,1.0,1,3
walmart,1623448953,nxrgsq,Am I going to get fired for taking time off for a medical emergency?,"So I was having some mild pains at work and then as I'm working I lift and suddenly have a crazy sharp pain in my abdomen! After an hour or so I decided I couldn't do it anymore. I leave to go to the ER and find out I had an ovarian cyst rupture, causing crazy intense pelvic pain and they gave me some IV fluids, heavy pain meds and nausea medicine and after 6-7hrs I'm allowed to leave. I was off yesterday which was perfect, but today I work and still in a lot of pain... I'm assuming I'm getting a point for leaving which would put me at 4. 🙄 (I only missed 2 days in April but because April 2nd is some holiday I guess, I received 2 points) and tonight I work but I'm still in pain... I don't want to end up in more pain but I def don't want to lose my job. 😒",1.0,1,13
walmart,1623448449,nxraau,Do you think Kim kardashian is a virgin,,1.0,1,4
walmart,1623448052,nxr5ez,Not passed my probation period just yet but I need time off. 😬,"So I was having some mild pains at work and then as I'm working I lift and suddenly have a crazy sharp pain in my abdomen! I leave to go to the ER and find out I had an ovarian cyst rupture, causing crazy intense pain and they gave me some IV fluids, heavy pain meds and nausea medicine and after 6-7hrs I'm allowed to leave. I was off yesterday which was perfect, but today I work and still in a lot of pain... I'm assuming I'm getting a point for leaving which would put me at 4. 🙄 (I only missed 2 days in April but because April 2nd is some holiday I guess, I received 2 points) 

Anyway I'm still in pain and I really think it would be unwise to go in tonight (work overnight, usually in paper chem) How likely am I going to get terminated since I don't have PPTO?",1.0,1,0
walmart,1623447867,nxr2zw,How do I get a phone off night service,Work at a garden center and the register is ringing non stop cause of night service mode we aren’t even open at night and doubt anyone even is out here,1.0,1,5
walmart,1623447853,nxr2sz,How much do the pro supervisors start off at?,Topic,1.0,1,3
walmart,1623447277,nxqv7r,Switching departments,I’m trying to go to sporting goods as a sales associate and my wife works garden center is there a policy that says we can’t work for the same coach because I haven’t seen one and that’s what I keep getting told,1.0,1,3
walmart,1623446457,nxqkm8,Wal-Mart Canada: What is with all the Status Cards?,"So I work at Walmart in Canada and I've noticed something really bizarre and off putting: A TON of white people presenting status cards.  


Don't get me wrong, I am white as a ghost with my only connection being that I'm the last of my family considered Metis unless I marry a native woman. But even then, I know that Metis is not the same as Indian Status and does not provide the same benefits.  
Yet day after day at the register, people white as a ghost like myself are presenting Indian Status cards. This to me is morally screwed up unless there is a reason that justifies this.  


What the heck is going on? Can anyone from Canada explain to me how this is allowed? Or is it ANYONE vaguely related to Native Americans can have status cards now? No, these people are not married to natives either, their husbands or wives are just as white as them.  


So whats going on? If there is a rational explanation I am happy to hear it and it will ease this confusion.",1.0,1,7
walmart,1623446105,nxqfti,How to quit short notice [context given in post],"To preface this, this is my first job so I'm still learning how to do stuff

Ok, so I've been working at Walmart since October but toward the end of last month something came up and now I have to move to a different city 2 1/2 hours away, I have been trying to work on tranfer stuff but my people lead is constantly going between two stores, and my store manager since telling me I had to wait a week to move when I finally got a move date (it was extremely short notice so fair enough) and I obliged but the store manager has not shown up for the whole week and I have no way to contact her because I never recieved contact information even when I asked it was always wait until they're clocked in, but it's been a week and my move date is tomorrow and I can't postpone it this time. 
I might have to quit just so I don't get penalized because I moved
There's also a bit of misinformation I was given, originally it was ""yes, they accepted your transfer and they're just waiting on you to move down"" now it's ""they said they could take you, but they haven't accepted you"" ???? The fuck?",1.0,1,3
walmart,1623444891,nxpzn7,How can I view my paystub at home,"When I use one walmart the my paystub tab always says error when I click it (I am already logged in).

I tried registering for paystubportal but it won't let me past the register page.",1.0,1,14
walmart,1623444627,nxpw3r,Genuine question about shelf caps,"So, we have an item that has multiple areas in the front end. For example ice breakers. It's on modular in four different sidecounter in separate aisle locations and separate modulat numbers.. Only one case of eight can fit at a time. So therefore the shelf cap is eight.

But another associate insists the cap should be 32 because we can fit 32 on the floor. But we can only fit one case of eight on each side counter location.

So therefore it is eight. It'll help with ordering and bin picking.


If the system over orders I'm about to say fuck it because it's happened in the past. But which of us is correct, or could be guided to be correct?",1.0,1,6
walmart,1623444103,nxpp63,I just want to rant about my store's damn dress code,"So I like to wear a jacket in the summer it covers up my scars so customers don't point them out, but apparently we're not allowed jackets let alone jackets with hoods on them. We are not allowed to wear patterns. And that's just the tip of the iceberg on what were are not allowed to do. I fucking swear I hate it here",1.0,1,18
walmart,1623443892,nxpmdx,Yet another promoted to customer story,"Was let go last night for occurances. My only regret is  that i never got to try the chance to lead the union revolution. Walmart is one the most disorganized places to work. It's a madhouse where everyone has their own agenda and the associates are caught between it like kids when parents are getting divorced. I made it all of 6 months but burnout is real quick there. The customers were fine to handle. But management is awful and I can't blame them since they're  a cog in the machine. For anyone wanting to work there I don't recommend it unless you have a healthy appetite for bullshit. And if you have mental issues it will only be exacerbated by working there. The manager told me that I'm rehirable but I don't think I will. 

Good luck to y'all out there.",1.0,1,0
