subreddit,created_utc,id,title,selftext,upvote_ratio,score,num_comments
walmart,1622869806,nso9bu,How do I put in my two weeks notice?,"How do I put in my two weeks notice? On one Walmart, tell me coach, or team lead?

Just checked my schedule and I was only given 12hrs this latest week.

This place makes me sick to my stomach.",1.0,1,7
walmart,1622869667,nso83c,Quit Walmart due to Costumers,I'm a Cart cleaner and I bring in carts. I had a costumer push a cart back at me because the wheels weren't good enough. Now I wasn't paying attention since I was bringing in cart. The cart ended up hitting me in the jaw and I bit my lip. I also got spooked by it and slammed my head the concrete above me. Costumer didn't say sorry or anything and it's not the first time I've been hurt by them with carts or riders. I quit right then but now I'm wondering if I should've gone to the hospital and got workers comp because I'm dizzy and my head hurts even hours after it all happened,1.0,1,17
walmart,1622868192,nsnu87,OGP Advice?,I'm starting OGP from maintenance and wondered if there were any tips from those more experienced? Thanks in advance!,1.0,1,4
walmart,1622868024,nsnsk6,Triggered at Work,"I work at Walmart (yeah I know, I know) and these stupid fucking rednecks bring their dogs into the store (no they are not service dogs). I got really agitated today and felt like my bipolar 2 was going to morph into bipolar 1.",1.0,1,45
walmart,1622867683,nsnpey,Help fast pls!!!!,so i have to call off tomorrow for my second covid shot because i feel like shit. when i call the line do i choose the covid option or personal option.,1.0,1,6
walmart,1622867058,nsnjha,What is coaching exactly?,"I've been with walmart for nearly 2 months now, and I need some advice.

I've been pulled into the back twice now into a private room with a team lead and another person of management. Both discussions started out as them basically saying I'm not doing my job right, but quickly turned into a discussion on how I simply haven't been trained on those tasks they had expected me to perform.

During the second meeting they suggested I transfer to another department despite us being severely understaffed. They never once said they were coaching me or had me sign anything. Both times they came to the conclusion that I need to be trained- or so I thought, but who knows what they're thinking.

I was wondering if this counted as coaching? Does coaching lead to termination? Should I transfer to another department to avoid termination?",1.0,1,9
walmart,1622865737,nsn6ol,Overnight stocker duties,[removed],1.0,1,0
walmart,1622865545,nsn4k7,new shirts/vests,was told to log on onewalmart (i believe) and choose something about getting polo shirts or vests.. can anyone help.. im so lost,1.0,1,8
walmart,1622865154,nsn0qm,I want to promote myself to customer so badly,"My managers don't give a shit about me. They think customer service desk is too hard for me now even though I've been trained over there. I just need the money gram CBL. 
I keep getting overlooked all the time. My front manager plays favorites and would rather train someone younger with no experience than a 30 something who's been here for 7 years. 
They may as well change my title to, looser at 14.
I wanna be prompted to customer but dammit I need money! Plus no other place will hire me yet because of Covid",1.0,1,4
walmart,1622863560,nsmknc,How many days in a row can we use PPTO?,"It looks like my unpaid vacation might be denied. It’s just three days in a row. Can I use my PPTO to just cover myself basically and call off? I’m asking because I know other jobs would require like some type of note or something as to why you are gone for more than three days in a row. Does Walmart even care, like as long I don’t go over my points.",1.0,1,18
walmart,1622862814,nsmdb9,Another promotion to customer post.,"Well after 4.5 years, I turned in my vest tonight. I was supposed to be done next week, but I hurt myself at work so I decided to quit instead of re aggravating it and going to my new job (that's going to pay me more) hurt.

While I am relieved and have no regrets about leaving since it's been shit with the restructure, it still feels bittersweet. Anyone else feel that way when they finally quit?

Anyways, good luck to you all!",1.0,1,0
walmart,1622861817,nsm32y,Help,Need to know how to get a good markdown score of 80% or more please,1.0,1,7
walmart,1622861673,nsm1or,Points not taken off for vaccine leave. What to do?,Earlier this week i went to personnel to fix my attendance (I took 2 days off because of vaccine reaction) he said he fixed it but I still have 3 points? Is there a hotline to call that will fix it? He’s on vacation now.. I just don’t want to fired because now I’m at 5 points total,1.0,1,15
walmart,1622861478,nslzqs,Can we not play Christmas music in June??,I don't care that it's in Spanish. Knock that shit off.,1.0,1,7
walmart,1622860551,nslqcz,"Love it when customers come the wrong way of the one way gates and when they open, they get hit.","For me, its the best part standing at the doors. There even is a damn red sign at the gate saying no exit, but customers cant read.",1.0,1,9
walmart,1622859950,nslka6,Can we get fired for having overtime?,"SOMEHOW I had 1 hour and 15 minuets of overtime. They didn't tell me until 1 hour before the end of my shift; I work in the deli, so I still had a lot I needed to get done. They told me to just do a few things and leave. Well I still have about 20min of overtime, and they said today was the last day to get rid of overtime (so I can't just leave 20min early tomorrow). I guess because today is the last day of the pay period???

Anyway, I don't know how I even got OT. I clock in on time, clock out exactly on time, and take a full hour lunch, sometimes an hour 10min. I think they just don't want to pay me for full time.",1.0,1,11
walmart,1622859205,nslc90,Been working here for just over six months and have never used the break room.,Does anyone else not ever use the break room?,1.0,1,20
walmart,1622858251,nsl262,Anybody else see the article for Thanksgiving 2021?,"What they're not gonna tell you is, yeah we'll be closed, but night shift still needs to come in because fuck night shift",1.0,1,7
walmart,1622857890,nskydl,How to get through this. Transferring next week and management is trying to find something to coach me for so I can't leave. I got five days left. Help.,Someone in the same department got coached for NO REASON after letting management know he's transferring.,0.99,1,12
walmart,1622857419,nsktk4,So what happens when there's nowhere to store Frozen pallets because CAP refuses to work freight?,"We no longer have a morning frozen associate to work freight so pallets have just been piling up inside the freezer and no one wants to work it. Now they are up to the door and I'm curious what happens if the store has nowhere to store pallets from a Frozen/Dairy truck tonight.

The ASM I usually see is MAD and isn't talking to anyone unless it's absolutely necessary. Sadly, my shift ended before the next truck comes so I won't see the initial chaos. 

Has this happened at anyone else's store?",1.0,1,6
walmart,1622857122,nskqhs,Former Associate,"Is there any chance of a former associate being rehired? I left on good terms and my ""exit interview"" papers I got in the mail said I'm rehirable. I know it says rehirable but are they known for rehiring people? Just wondering, I'm applying for overnight stocking if that makes any difference. I worked there for over 2 years through high-school and have hit a rough patch now in college and need the job and I still know people there so I figured why not.",1.0,1,13
walmart,1622853957,nsjtfx,After getting fired from walmart how long would i have to wait before i can be hired at a different location?,,1.0,1,5
walmart,1622852742,nsjgrf,Other way to report an absent other than calling ?,Is their an option to call out using one Walmart ?,1.0,1,7
walmart,1622852159,nsjagu,"Coaches, supervisors, etc. How do you feel about workers you know come to work under the influence but still perform?","With me being at Walmart over the years I’ve pretty much noticed out of about 100 associates 40 of them most likely have a sip here &amp; there in the car on their break (this one team lead i had carried a thermos around the store) or take a few puffs but they vary in the sense that some are the ones who get fired 2 weeks in &amp; some are those who you’d never would’ve guessed was under the influence of anything getting work done robotically. 

Source: getting to know &amp; talking to a good number of people a decent amount of years at Walmart from 16yo maintenance/buggy associate to late 20s &amp; higher up in the store, seeing this all first hand on all levels.",1.0,1,9
walmart,1622851439,nsj2h8,DA unloaded/processor,Hey guys I got a call from my HR manager about a DA unloaded/processor position she told me about the position but I wanted a little more insight about how the position is day to day. I hope it’s mostly unloading with a forklift. Thank you guys in advance.,1.0,1,3
walmart,1622851394,nsj1zz,Today was my last day at my store since I’m moving on to a better position and me and my manager said a tearful goodbye. It’s hard saying bye to great managers/ coworkers. I’m still sad about it.,,1.0,1,4
walmart,1622851374,nsj1ss,Does it matter if I chose the wrong reason for calling out in the Associate Information Line?,,1.0,1,6
walmart,1622851038,nsixuj,Accountability,"One of the rolling wheels at the beginning of our line fell completely out over a year  ago,  i throw the truck everyday with this stupid broken line where freight immediately falls in and jams up everything if it it's put before the gap or set just perfectly so.   I'm tired of management blowing me off when  I complain about it.   They can find somebody else to throw the truck from now on until there's some  ""accountability "" for my team not  having proper equipment to work with.",0.99,1,7
walmart,1622850883,nsiw8l,Starting as an O/N stocker soon! Any advice you can give?,"Hello! I'm starting soon as an overnight stocker soon in a Super Walmart (I believe) and I was originally working at Target in OPU and Flex for 3 years. I've been told by someone who's been there a month it's hard sometimes and the managers can be kind of tough or unfair. The only issue I can see is me having plantar fascilitis (but since I got shoes for it the pain has been almost nonexistent.

Everything I've noticed is a huge opposite to Target, including only managers having walkies and not really having zebras/scanners to use. I'll do my best to go as fast as I can!

Is there any advice you can give to prepare for or to be more efficient at the job? It'd be greatly appreciated!

Thanks!",1.0,1,13
walmart,1622850867,nsiw2w,Awful PL,"If you have an awful PL, that is never helpful, what would you rather do than talk to them?",1.0,1,8
walmart,1622849842,nsikwy,How to extend covid sedgwick leave?,"So I don't have covid, as tested, but I put my return to work date and then had to change it because I was still sick and throwing up. It lets me change my return to work date for a few days later, but I don't know how to actually get paid for the days in between my original return to work date and my new one. I didn't even take the ten days, I only took four. Anyone know how to fix this? I'd ask personnel if I weren't worried they're going to guilt trip me about my health.",1.0,1,0
walmart,1622849842,nsikwn,What is the policy on graphic shirts,Can someone please point me to the exact documentation of the t-shirt policy an employee that I know has a printed shirt and is told that they are not allowed while seeing other employees with printed shirts.,1.0,1,9
walmart,1622849569,nsihuy,Covid Vaccine Horror Show,So I had my 2nd dose scheduled for tomorrow at Walmart. Walmart pharmacy called me and asked me to come get vaccine tonight since they had extra vaccines thawed. I drive 30 mins and they tell me I have to go back tm due to state regulations ! I’m pissed only because they CALLED ME. Hope my appointment goes smoothly tm,1.0,1,3
walmart,1622849532,nsihg6,What is Walmart Interview Like?,Got a call today from Walmart about an interview and now I have one tomorrow morning. I’m 18 and never had a job before so I just wanted to ask what the interview would be like?? Easy? How the questions are?? And I wonder what type of questions they will ask me since I’ve had no work experience before.,1.0,1,9
walmart,1622849530,nsihf6,i need an opinion or three,"if my HR lady doesn’t fix my schedule by the next three-week out should i quit? i’ve been told for two months that “yes, you’ll get mornings once we hire two part-time or one full-time person,” well it’s almost three months and four part-timers later and i still don’t have mornings. my coach, TL and HR lady _know_ that i want mornings. im already looking for other options for work anyways since i’m down to my last straw.",1.0,1,6
walmart,1622848667,nsi7vt,"PPTO time off request pending, why?",I work overnight. I was scheduled 11-7 so I submitted a time off request for 23:00-24:00 for one hour and 00:00-07:00 for 6 hours. I’ve never had a PPTO request pending before. Any ideas?,1.0,1,12
walmart,1622848607,nsi76b,Taken off schedule hours before shift?,"Long story, short. I was scheduled to work tonight. I put in protected pto after midnight this morning for today as a way to pad my check and get extra hours on it. Checked my schedule earlier and the shift for tonight is gone and so is yesterday.

Am I scheduled? It doesn’t show that I am but I’m not sure. I’ve done this before and this hasn’t happened.",1.0,1,4
walmart,1622847318,nshs9f,Retarded Overnight Coach,"My Overnight Coach is absolute garbage. Even though food and consumables have been priority since fucking forever, our moron starts his team off on GM and slowly makes their way to FDD/Grocery/Consumables. When I mean slowly I mean **slowly** because when I walk in at 5 am they are usually still in GM, and if Im lucky they'll be ""swarming"" Frozen/Dairy. What this ""swarming"" looks like is one of their slowest and most useless stockers takes 5 minutes to pull out a pallet while the others just stand around doing nothing and chatting. Coach and TLs on Nights are nowhere to be found and are usually smoking out one of the truck bay doors, far away from the team. When I confronted the Coach and TLs why the hell they start on the least priority shit their excuse was ""the team is used to GM, they aren't used to grocery."" Okay retard

I'm tired of being a glorified stocker and drowning every day. I'm tired of freight. I don't want to throw freight anymore. I'm demoralized to shit. I have a dream that one day I will walk into a clean backroom, even though I know it's never going to happen. GWP is horseshit",1.0,1,8
walmart,1622846134,nshee1,PickUp Tower,It appears our pick up tower program had failed. Eventually ours will be removed. I wonder if they wil take the lockers too.,1.0,1,8
walmart,1622843845,nsgmb8,You know what sucks?,Running fucking candy upfront.,1.0,1,9
walmart,1622843603,nsgjbx,COVID leave,"Ok so I am almost 37 weeks pregnant and My doctor wants me to quarantine before my due date (6/28) so I started a leave for 2 weeks so from the 3rd to the 12th then my maternity leave kicks in. However I just checked and only the 3rd and 4th got approved and the 5th-12th is still pending, why is that? Do I need to call out those days or not?",1.0,1,3
walmart,1622843417,nsggyz,Break policy,Does our 15 minute break start as soon as we leave out area?,1.0,1,5
walmart,1622843206,nsgeab,Thanksgiving Day,"Do you think the company will be closed again for Thanksgiving 2021

[View Poll](https://www.reddit.com/poll/nsgeab)",1.0,1,8
walmart,1622842154,nsg0w1,Samsung Galaxy Xcover Pro,"Does anyone have anymore information about this? What departments will get them, who will not be getting them? When can we expect to see them coming out? Just curious",1.0,1,41
walmart,1622840269,nsfc1x,Free $500 Walmart gift card,"Is there anyone looking for Free $500 Walmart gift card, if yes then reply me now in the comment below, gift card valid for the next 48 hours only.",1.0,1,0
walmart,1622838107,nsej55,Just had a fight at my store lmao,,1.0,1,8
walmart,1622837732,nsee4b,To the old lady who had to wait five minutes for a cart...,"Fuck off will ya. There's only one person who's pulling the carts, and me and other people had to help him out. ""This is ridiculous"". Well yeah, that's Walmart for you.",1.0,1,26
walmart,1622837651,nsed0j,So Walmart Canada appears primed to be rolling out GIF 2 by the end of Q2. What do I need to know?,"Hey all,

I’m an E-Comm Operations DM at a store in Canada. A link to “GIF 2” has appeared at our workstations, the GIF 2 app has been downloaded on our TC’s, and GIF 2 / Mobile Office Process Guides have appeared in ULearn for CBL’s to give us a chance to get a sneak peek on what it’s gonna look like (though they haven’t been actually assigned to us yet, they just exist). It appears from the process guides that the rollout is scheduled to happen by the end of Q2 (roughly July). I’ve heard American stores have already been using GIF 2 for quite some time now. My question is, how is it? Any pros/cons from GIF 1?",1.0,1,4
walmart,1622836043,nsdqqh,Gotta quick question regarding three days post vaccine shot,[removed],1.0,1,0
walmart,1622835863,nsdo6g,"Be kind to your delivery partners. Without them, we wouldn't be able to offer Online Delivery.","It just takes few kind words to make them keep coming back. Saying things like ""thank you for delivering with us. We appreciate all you do and don't take you for granted. Have a safe drive"" will get them to come back time and time again. Remember they aren't making bank especially if they are delivering mega batched orders.",1.0,1,18
walmart,1622835842,nsdnvu,Store managers at walmart I have a question for you.,So im 28 days til I move and want to put a transfer in but im half a point too much. My last day is the 30th which is 2 days before I move and my store manager told me to log into the wire at my NEW store under my wire log in. Would a store even let an associate do that? Another thing I was curious about is this mobile time clock thing. Does it work at ANY Wal-Mart' or just my home store? My store manager told me she wouldnt even PUSH my transfer for attendance but its not like im asking for all my points to go away. I just asked her how could I do the transfer. I feel like my only resort is QUITTING but then I have to wait 90 days to rehire wouldnt I? I dont have the luxury of waiting for 3 months to be rehired. I just need advice and I feel my store manager just is being a bitch. No one at my store likes her.,1.0,1,10
walmart,1622835663,nsdle2,"Is there anyone is looking for free $500 walmart gift card, if yes then reply me now in the comment below. Gift card valid for next 48 hours only?",[removed],1.0,1,0
walmart,1622835448,nsdi7w,"I currently work at Panera. The Walmart near me if hiring for night shift at $14.50/hr. Definitely more than I make as a team lead at Panera. Anyone who works the night shift, or has in the past, is the pay worth the work? And how are your sleeping schedules? I’ve never worked nights before 😅.",,1.0,1,9
walmart,1622835403,nsdhiw,"Managers, help me settle a debate!","Which ear do you wear your earpiece on????? 

[View Poll](https://www.reddit.com/poll/nsdhiw)",1.0,1,6
walmart,1622835313,nsdgaa,Was I wrongly terminated?,"Got into a physical altercation with another associate who had been trying to get into it with me for months. He had also been trying to bully other associates as well. Leadership in store knew this was going on. 

I was never asked my side of the story or to write a statement. I was told the day after the altercation I was fired. I had never had a problem with anyone else or been coached for anything before. Is there some kind of investigation report or anything I can request from my store showing why I was fired?",1.0,1,4
walmart,1622835008,nsdc1m,Does Walmart Hate America if they make associates work on July 4th?,,1.0,1,29
walmart,1622834545,nsd5mg,Self quarantine - approved by store?,"Question for everyone out there. I'm sorry for yet another one about the covid leave.

I've heard that a level 1 leave has to be approved by the store, is this true? If it is, is there any way to appeal a denial? (I'm sure it will be denied, long story, but people lead doesn't like me.) The policy on onewalmart just says to file through MySedgewick and call out until approved.",1.0,1,1
walmart,1622834198,nsd0mr,Trying to get full time,[removed],1.0,1,0
walmart,1622834106,nsczdd,Morale in workforce,"So with our recent market manager visit, I a convince all mid to upper management havd a stick up their ass. Way too serious about Walmart that they can't even make a joke or laugh and attempt to act human.  It's like working for a team of Colin Robinsons. This store is a vacuum of souls. (more than most)",1.0,1,14
walmart,1622833468,nscqmw,Transfer?,"So I've been at this current nhm Walmart for almost 2 months making $12 an hour as a front end associate. Another Walmart (supercenter) nearby pays around $17-$18 for ogp and stocking and that would be a big bump up for me, so of course I'm interested. Not my first rodeo at Walmart so I know a lot about the front end and all.

So the problem is I've heard that you need to be at a specific Walmart for 6 months to transfer to another one, or at least make it easier to transfer. So anyone who has transferred or knows about how transfers work inform me on how this works? Thanks",1.0,1,1
walmart,1622833436,nscq67,PPTO,How long after working at Walmart do you get to use PPTO?,1.0,1,7
walmart,1622833059,nscksm,What happens if a store fails inventory?,Looking not good for my store. What happens?,1.0,1,22
walmart,1622832293,nscak0,Concerned about COVID self quarantine...,[removed],1.0,1,0
walmart,1622832115,nsc833,"Karen wants to know if we can keep the store open, so she can go shopping","(I only heard one side of this conversation, but was filled in after the fact by the TL and Coach involved.)

10:54 phone rings, answered by TL:

Karen asked what time we close. TL says 11. Karen asks if she gets in the door at 10:59 can she do her shopping and get checked out. TL said, yes if you get in before the doors closed, you will be allowed to do your shopping. 

Karen steps it up: Well, I can't make it before the doors close. Can I get there like 5 minutes later and you guys let me in so I can shop? TL: No, once the doors are closed, no other customers are allowed in. 

Karen: Well I already said I was coming. You should let me in, just because I get there a few minutes past shouldn't be that big a problem! TL: No we can't. 

Demands to speak to a higher manager, because she doesn't like the first answer. Coach explains to her in NO uncertain terms that the store closes at 11, we don't let any customers in, that's the rule. 

By the time this conversation was over, the store was closed. I don't know if she showed up anyway and tried to force her way in, as I left a few minutes after that. If she did show up, I would have loved to have seen that.",1.0,1,29
walmart,1622831904,nsc56b,Closed thanksgiving!!,"Just heard it announced on walmart radio!!
LETS GOOOO",1.0,1,12
walmart,1622831811,nsc3zv,Should I go to ethics?,"Okay so to shorten a long story, my SM, Ops Manager, and TL are all telling everyone at my store that we will only be paid for 2 days of vaccine symptoms and not 3. I have shown my TL the One Walmart COVID FAQ where it clearly states 3 days and her response was essentially ""okay well SM and Ops said 2 days so it's 2""

Should I contact ethics over this or is my SM allowed to make that decision?",1.0,1,4
walmart,1622831433,nsbywn,Promoting myself to customer,"I'm food sales and I'm the only closer for dairy and the rest of grocery side other than meat, produce, bakery, deli but I'm still making a little over 11 after almost 5 years.

It's pretty bittersweet seeing as I have a lot of friends here but I can't handle this stress anymore. 

So Goodluck everyone.",1.0,1,6
walmart,1622830436,nsbm75,Shocker!,Manager is actually eating the break room! I'm shocked. Lol,1.0,1,12
walmart,1622830133,nsbi63,"Hey y’all, question, I’m currently on medical leave until Sunday, I’ve already had that approved. But now I’m having to take more time off, but my doctors refuse to give me any more excuses for work even though I’m in so much pain I can’t walk. Can I just take a Normal LOA without getting point?",,1.0,1,8
walmart,1622828535,nsawi5,Me@Walmart Question,"Apparently you can punch in/out now according to ""What:s New"" but I don't see that in the app. Anyone know where that feature is?",1.0,1,7
walmart,1622827311,nsafyb,"If you guys show up late, like 11 mins late do you guys clock in or just wait till lunch to say you wernt late?",,1.0,1,8
walmart,1622827037,nsac58,"What do yall do when a customer asks if you can check the magical area known to them as ""The Back""?",,1.0,1,23
walmart,1622826747,nsa89b,I'm A Dumbass,[removed],1.0,1,0
walmart,1622826208,nsa0y6,Is coaching possible?,Our team lead let us know today that they are going to start coaching us for unproductivity and leaving the team shorthanded if we leave early. Even if we use Ppto. Are they allowed to do that?,1.0,1,14
